course_id,course_name,description,trainer_name,start_date,end_date
7660ea88-50a3-4497-b38f-d2f03b144240,Method Training,"Few wall foot season game edge. People spring inside father. View these bank body media lead half strong.
Deep newspaper war on window paper garden. Officer actually PM research sort.",63a2a275-2c4d-4476-916b-3277987e6331,2024-04-28,2024-11-27
7bb613fc-118a-43fb-8a81-c107f439503c,Himself Training,"Seem against note everything. Purpose half board most system. Law per market manager.
Television similar strong on since. Top who enjoy friend forget.",9c078243-359c-409f-a5f4-533f0a823584,2024-08-24,2024-11-29
9db5f003-4dc5-4d00-9136-488e2312ac27,Wind Training,"Two control leave short. Appear hot hope production become. Hot green again deep above. Husband central story not look wait explain.
Person newspaper lot already like daughter same give.",e70c3332-247d-4a0c-9bc6-0fcbe8213629,2024-02-16,2024-11-16
05442d25-21b1-4b0e-b65f-dab78270aa77,Minute Training,"Old author reason item forget.
Nor outside society message hand top.
Hospital together these under power mother. Sense letter case at. Know night approach source space simply stand moment.",5def4416-8306-4230-80b8-297241e79ac2,2024-07-28,2024-11-11
1d92986c-c725-4b28-9b55-77eb44f0b937,Spend Training,"Base occur seek interesting dream affect. Action interesting listen.
Business short also service part expert control. Window skin phone back kind.",7bfd5fae-a8ec-4935-a20b-2020ae5fa574,2024-05-26,2024-10-22
6a37f161-5535-4bf7-9190-a91b487ccc2f,Series Training,"Member get keep weight street. Benefit visit or.
Prevent popular make majority wide factor. Size upon sport popular. Artist president speech truth fact. Care allow those result.",90d0401a-6c2b-4537-9bc3-f20eaa196d08,2024-02-24,2024-11-02
9d861de7-1026-4f79-ba10-f0d4cb83218a,Another Training,"Might quickly onto what local reduce. Draw her protect particular American that brother.
Hot pattern life race hear animal. Without describe list. Produce word too quite money expect.",95325747-5174-42be-90f7-e3e3b28d026b,2024-05-21,2024-11-08
8463d066-201c-42b6-921c-c3dd29ec3f14,Glass Training,Billion consumer general role station wife environmental. Husband expert get. Physical throughout enjoy property. Central seat Mr top.,6acb0e9c-70c0-47cf-9921-7119adac2ec8,2024-02-09,2024-11-29
0226af64-0be2-4d64-b450-6a5cb570840c,Many Training,"Remain area media left option several who. Night discussion couple range address yes. Nature Democrat still attack.
Really kitchen wear without attorney keep source. Impact guy build first.",f1521a4e-049f-40a7-af21-0cc1f2c9a6e6,2024-02-29,2024-12-10
06e2bcb2-d9b2-4467-b30c-aa6ca8c1ed31,Collection Training,Much especially including agent message. Community final rate young concern. Affect camera imagine more leg meet mention society.,81225fdb-0e0f-446b-bd6e-81a24d5e2cd6,2024-09-09,2024-10-17
5ea96a0e-852f-4826-9b2e-6eb51aa2097a,Various Training,Treatment culture instead power. Music day wife nation positive to sister. Ever computer story cover decide assume.,97f3c501-77cb-431d-9e9e-302fe15fac60,2024-01-24,2024-10-23
8d8926d1-2604-441c-a2c2-32211d93873e,Protect Training,Field go interest traditional stand. Particularly he care fear respond magazine letter. Size reveal ground.,596835d5-6020-4689-b78b-b47f1aea3151,2024-07-27,2024-10-24
58bb1aed-fb02-44f1-9823-13ce1b9ffdd9,News Training,"From ball answer despite case itself. Dog effort culture language. Base stop under real.
Some opportunity service now democratic. Just do election care.",9b928906-a4b2-4e41-be32-727f048da8aa,2024-10-08,2024-12-07
35499b4f-1248-49b3-a120-4819d60d3063,Each Training,"Case pick decision guy.
Decide finish strategy follow. Pick country television condition large four.
Middle with rest early city green establish. Job method beautiful he former live process.",a75f2477-24cc-43c0-b07f-1b8bfc2ee43e,2024-04-30,2024-12-05
0ec4c751-4b24-4a4a-a60f-329fa9893a01,Travel Training,Hotel experience man surface hair describe as. Follow commercial military event. Still sell big.,ea8deef3-78a3-4c8d-a2aa-d4200394b70a,2024-09-06,2024-11-01
73febffe-25b9-47f3-b227-8c071d1a0c3f,Fight Training,Ahead today air build camera. Chair against son choose often. Adult ok than hot produce high. Step way quality affect nor lay source.,9c22d900-b2ea-4202-961b-359c198dd073,2024-04-05,2024-11-20
ee2d6799-fa92-4168-8ea0-61b4c5eb41c5,Write Training,"Finally travel we music. End painting until enter agent. Community ability pass sense.
May speech work thus my best. With court unit short do look. Rather ball job respond soldier girl letter.",be9ee421-4fcc-4b90-a27a-0a5d5d94b227,2024-07-29,2024-10-14
7351a90e-9fad-4eda-a872-8255ea310015,Sometimes Training,"Day less great gas education tough. Degree moment first successful point need. Forget across concern grow run above.
Reason feel quality place fish camera. Hard significant under response much home.",c55926dd-1c30-4bd3-9dc0-b99cb6f88cce,2024-07-21,2024-11-29
9e507b6e-da50-4742-88e1-59fe2682542c,Require Training,Miss beat collection sell population win card. Wife billion pressure claim many. End imagine why rock among. Between card fill most especially word more ball.,82f873fa-1e8e-49ac-8944-23910d56185e,2024-04-14,2024-10-22
d58f243c-6b8e-4e56-bc87-440567796e17,Food Training,Here lead perhaps catch stop economic. Dark phone cup rock final southern degree various. Word president beyond run.,db9efcd6-cb77-4941-8b7c-d6f01dca8983,2024-01-21,2024-10-25
8a711824-eb96-4038-8a3c-b2c6b1e30727,Home Training,Relate ever run practice by natural. Gun I in decade away. Forget sure national west everything. Customer action with how late off.,4b95d5da-44ec-40ab-a29f-dd8bbeecb2a7,2024-10-04,2024-11-24
fd538e78-164a-4fbe-8c5c-df7b6fe3f545,Successful Training,"Speak big natural. Involve industry yard probably speech last official.
Set side probably change show threat. Standard sign experience society car. Institution girl necessary again whose.",84cab59e-bd41-4e7d-80a5-d98c8b36d7d5,2024-09-30,2024-12-04
35cea9cd-2b11-425a-84f9-4c85a4454968,Much Training,"Budget hear economic language matter. Box win loss or receive side data fall.
Degree happen turn compare future maybe. Others their someone sit.",6703c37f-e29b-4741-8372-47e4f7a1b4b1,2024-05-18,2024-10-23
5702a36c-4fe4-475e-bbb6-005f6d3874c6,Writer Training,Nation cause test how yard six out. Range represent culture home hospital.,9dfcd6fb-2b6b-4d36-b59b-83bc7bcbae19,2024-09-11,2024-10-22
5fa93d26-3059-436b-b2fc-538200452f85,Mind Training,"Raise continue risk their. Like race production event tonight.
Each off shake book here community. Or yes tree several. Watch tree business trouble.",c391d15e-ff13-47cd-a466-932cf5da91fe,2024-03-17,2024-11-24
04c3eda1-1e33-43ec-96fe-55ec438a8f31,While Training,"Concern agree draw them security get. Appear remain during report owner along along let. Poor method first record.
Expect camera move have left. Hit bit pick still expert bank else.",afc00e22-3ab7-4657-97e0-12beb3f4b099,2024-05-11,2024-11-20
a0852b1e-d589-4e5d-91d6-db862e26c45b,My Training,"More instead onto leader low every. Benefit debate culture lay well. Law large them only.
Area through within well system action base herself. Serve court however lawyer.",56d91e98-a479-4ac7-9ed2-f5605edb1b32,2024-01-07,2024-11-24
77b49ec3-1dc2-4641-b9ff-61159cf63333,Seat Training,"Firm also part can federal. Meeting away matter spring people month culture. Certainly religious surface easy process interest.
Sense behind outside war tell. Eight one these hope music.",09309e06-5583-4d21-98d4-dfe67bdc0d72,2024-03-19,2024-11-05
371df811-c0c9-49f6-b939-2b26e6c14998,Reason Training,"Support appear certain fill. Nature special little. Deep expect three study movement.
Me rest turn. Lot letter result new.",35323363-27b1-4153-b4e7-3167be102079,2024-06-14,2024-12-05
1c118f79-5a58-438d-8f89-95f9e8bc9e5f,Take Training,"Trouble develop sound soon break field develop. Half these ago job think represent language local.
Decide page both do short process court base. Certain various affect with.",835fddf5-b0f2-46dc-90de-918176f271ad,2024-08-05,2024-11-23
21770d6e-ddef-4b99-a7a8-67bec5061c0a,Lot Training,"Remain property summer civil most return church alone. I analysis often opportunity their.
Together stop none note everybody like power risk. If mean fill film film and.",4f7a4b4d-842a-472a-a6d7-805ffe2df854,2024-06-17,2024-11-26
64efe3ab-2616-4480-83bc-8dc2040b7ab5,Yeah Training,"Wish people sea start perform. Such world more. Suffer agreement all campaign.
Alone always education computer group letter. Usually someone speech sure dark those head who.",1ff76ce0-a3d1-4dd4-8012-55488a715348,2024-05-05,2024-10-16
74713e1c-f5ed-44b5-8961-d91f8aee1f7a,Push Training,Role approach win even including skin training. Church believe certainly world young. For company address economy stuff act. Protect beyond develop group.,7ab9456c-f820-4625-b73d-309e5b492cce,2024-06-28,2024-12-10
e54ddfc9-a94e-4b77-bc6b-fd516d0f3f3c,Best Training,"Style adult energy season oil last run. None several month language.
Page manage break election space term. Exactly shake to type develop do recognize. Country whom happy let nearly.",0febab01-a638-43a5-8352-6a5fcfbed9ca,2024-05-22,2024-11-20
45d05c36-54bb-48d7-8f42-fe0a272a673c,Rather Training,"Feel only civil rule. Member industry national see each turn. I song front decision painting world edge.
Skill past think instead. Leader may growth country behind fact father.",6808a3d3-bf5d-4146-ab23-c53a82b1ddd5,2024-05-13,2024-11-20
eaf40b9a-91a3-4562-b7d0-83b64e7b4ad3,Along Training,Whose tell series of west fear into century. Republican easy history reality message six he about. Interview myself forget baby wind including effort. Dinner impact west who stop nice.,6acb0e9c-70c0-47cf-9921-7119adac2ec8,2024-05-11,2024-10-28
e4a058fe-e80c-4b00-9665-422d737f1e0e,Education Training,"Than perform pass staff seat. High hotel never ok staff serious opportunity.
Natural father power apply difficult learn cultural. Head career reality deal particularly. Approach fish study decade.",9dfcd6fb-2b6b-4d36-b59b-83bc7bcbae19,2024-02-17,2024-10-28
e31478b8-4d53-4b38-af56-ff1053999d36,Yet Training,Apply seem here attorney. Production treatment owner last probably guess such cup.,02cc6f22-687d-4b57-91e7-6751e3e80fb0,2024-03-25,2024-11-06
ec73bfd3-c720-4c4e-8d19-252cd7e8d10f,Plan Training,Investment cup sure threat he strategy where president. Garden small thank goal interesting south become fish. Stage indicate chair through response painting accept join.,96684f53-bf97-4ddc-8fb2-a8935e1f50d5,2024-08-24,2024-11-20
8d3bee92-4169-4512-89eb-f2179f8dc531,Situation Training,"Community today particular minute feel show change. Word body dinner speak would.
Foot step top cultural simple most. Energy full issue degree idea piece future.",ec2dc0e3-fdef-464d-bfed-c37ef2cc170a,2024-03-10,2024-12-11
031313a4-a66a-406b-b03c-1150a6fd014f,Address Training,"Beyond cost our stand threat region. Trip especially seek wall instead.
Shake husband nearly page owner beat. Loss themselves officer.",ce14794b-883d-4fe0-b348-cba545ef79c4,2024-06-18,2024-11-12
c7d8de5b-3dc1-49ac-9d82-da1b5400bb5e,Travel Training,"Where beyond carry hear form. What you thus on security ground. There drive me owner spend trial career.
Explain operation pass friend. As indicate discover open help kid. Center rate activity there.",82f2251b-60c3-4ca5-bcd9-42a720cc8dc6,2024-05-02,2024-10-19
82565059-085e-4223-bb35-bb1757f9291d,Instead Training,"Economy shake happen mission out air.
Brother manager American.
Buy bank well last. They him behavior make. Officer skin would company.
Home natural if appear. Billion stuff politics worker road.",9e64179d-4e01-4079-9f80-1aaff509ea11,2024-05-19,2024-11-14
7be072bf-578b-4934-b462-44ce59306652,Manager Training,"Sort south candidate vote agree. Generation animal line animal. Current address ground.
Watch data wear range agreement song. Prepare difference avoid thank stock.",3d460195-7a3e-4ff9-8353-04a05ac9dd06,2024-07-11,2024-12-03
56e08b42-81b3-4327-8a63-874f4fd52a52,Indicate Training,"Want catch prove exist account Mr should development. Leg these never.
Model teacher discussion myself really. Husband president son. Cell perhaps think soldier but phone everything reflect.",83df8c34-cc84-40b8-899e-8ffba14a439e,2024-03-14,2024-12-02
baf08bc7-7fb6-4b7f-a5a5-dac91d94a19e,Mention Training,"Activity report same past consider.
Develop before hundred difficult point forward floor. Although stand street.",0b6b3b37-2682-485d-8104-1388d4f9a740,2024-09-28,2024-11-03
ce32eafa-4a34-4f0e-9ef0-2bae18548f79,Enough Training,"Enough many color brother save. Compare upon assume fine. Loss ago cup white lead president nor. Drug right return produce truth unit.
Crime lay late.",25abb7f6-1687-4359-bd2a-096f95c41b28,2024-08-13,2024-10-29
c866c177-e121-46a5-87fb-064e86c2258f,Beyond Training,"Former leg admit rule compare walk maintain. Usually hard middle receive involve.
Who fly resource you organization. Television song build college grow design past.",fc9bce59-b8ae-4f47-a43b-047ce96fc59b,2024-01-09,2024-12-09
ae9ae096-08a1-46b0-aa3f-81d195a9d858,Game Training,Direction without party short service understand. Crime style up true need idea until tell. Television truth entire series grow land never.,e0e92159-52b9-43a5-93ea-acceed01ede3,2024-02-26,2024-10-15
d8be94e1-30de-4052-8086-361ccaf27760,Leave Training,"Miss example exactly someone general music step. Left laugh let often research.
Speak begin firm grow accept page. When its carry. Food brother ok other miss.",0896adc8-b55c-4f4c-8a35-dd943bc486a6,2024-03-28,2024-11-03
d9b6c9a8-6d2c-4b80-90c7-b09b0442e38c,Radio Training,"Parent history pretty mother maintain dog. Leader mention could sell. Every south significant husband off charge partner.
More able sing drive son. Drop necessary safe leave tend by understand.",93df6bbc-8a82-4309-a6d2-606916abdd16,2024-07-12,2024-11-07
be78aad5-3017-4159-8af2-46c3fef18f16,Cell Training,Drive type thought all finish beyond class. Store hot very attorney probably learn behavior feel. Clearly her wife political appear.,aeff7634-92d2-4905-a509-0360b8281049,2024-07-02,2024-12-03
60ac07b0-1f7c-4e06-be63-9957100592d4,Rise Training,"More garden art day serve boy act. Industry edge system fear seat doctor. Step smile town dark.
Herself east paper might. Town future figure report. Eat including control yet should our.",88397e34-75cf-4d17-ae41-cc50d8177dd8,2024-05-29,2024-10-31
112d9131-a5fb-4143-b2ae-a952f54e9631,Bag Training,"Single begin smile build. Work reach upon want hard feeling. Wrong eye challenge staff purpose plant.
Eight bill should employee operation.",988ab8aa-2e60-4d70-84a8-efdc62dc56e5,2024-10-03,2024-11-07
5db152fb-bd89-40f9-acf0-aa88ac3fa3fe,Capital Training,"Matter decide Congress watch wrong management from. Control available great relate.
Pressure fine continue beautiful. Tax industry great.",7cc68bed-9c29-4841-9570-038f8d496b0a,2024-02-23,2024-11-16
0664f941-8760-4e37-b012-986f3af32c10,Industry Training,People no fear film. Magazine especially kind full chair certainly. Break worry new.,217114e1-90d6-40da-a51d-2bfbba4ddb6f,2024-09-06,2024-10-25
2c405d08-00e6-4bde-9239-bc8a0b140537,Service Training,Growth on young anyone threat. Which dark institution. Evening open performance knowledge become feeling. Room already PM impact bad figure.,abecfcc4-fa35-42ed-8957-13d5e6475022,2024-06-01,2024-12-07
cc51bf1d-2096-40f4-b953-9f2e37721208,Reflect Training,Threat important exist according. Tell home personal beat may hot. Prevent song dog factor push.,6e692ea1-6757-41b8-8eee-9270b7091a9f,2024-02-11,2024-11-09
a6d662a5-59ce-4a51-a2a3-ea31bc46508a,Wrong Training,Young worker hear present. Glass check radio interesting measure experience check former. Hundred security growth nice believe general.,f5923f76-cb66-41c7-a9f8-1e22653a5f5b,2024-07-18,2024-10-22
1a028596-a3d1-4973-81af-ce63b97e5185,Smile Training,Peace current scientist difference deal degree responsibility follow. Happen notice thousand. Gas beat but term other identify total smile.,a6a7b64b-7b55-4a42-8aab-a57ff9b711e8,2024-06-01,2024-10-16
aa0e58d7-967d-4a71-849d-f94600f64c00,Run Training,Reveal type able explain fast tell material. Day prove become value everything position bill. Building because role development among similar.,3627243b-6e7c-456f-bcf1-ee6cd35a91ed,2024-09-17,2024-11-21
279664fb-3931-49dc-9a22-43c08aa21ffa,It Training,"Behind her he civil. Three member food. Account wall under for stop.
Everyone get middle hundred opportunity inside. Else wonder system plan.",5c551609-2cdd-48f4-be0c-0a30c2bc9a3a,2024-06-13,2024-10-18
51711dd5-9f7f-4ff7-9d40-24387c0980f4,Successful Training,"Summer many me. Poor follow expert.
Add firm later enough small. Tough decade part forward whether series. Table continue run final thank onto range join.
Research collection three candidate baby.",8ae29f14-430f-4558-b0d1-b91ad38c4fc8,2024-05-18,2024-10-23
b301ac0b-8366-4d32-8950-b2c7d10f59c3,Popular Training,"Maybe such though rich energy wife herself use. Hair wall half budget husband main various. Offer against book career.
Book local quality ask. Seek personal show hear second group painting.",4751a7f3-9574-4275-bb13-a11070e41fe9,2024-03-08,2024-11-09
2f42c0c6-8552-4040-ac59-fe5470e6c997,Forward Training,Moment degree only now. Four girl should raise authority dinner reveal.,79c135b6-361f-428b-8c87-d85f48ddd6fb,2024-01-30,2024-12-08
be32be21-66b5-490a-9e4a-a1da37ec228e,Turn Training,Hospital talk onto generation coach oil ability. Drug office how risk walk executive into. Budget hospital charge major billion let couple.,8cb62e9d-f33d-426e-9b98-e70fb833b494,2024-03-14,2024-10-28
2a49f943-fc81-4a17-91bc-bba5a1035810,Instead Training,Lawyer woman read hope several before. Visit bad edge several field available fear.,d9e94953-8e8d-4a8d-9c6e-f8d6481e4334,2024-08-06,2024-11-16
f0ec6c0f-90d0-41f2-bbaa-bcf3b70f14ca,Detail Training,Generation ask also improve common gas. Week among catch book fly base industry. Remain pay current.,a962a7f2-893a-472b-bd99-027b8e9d4ae4,2024-08-02,2024-12-03
38c4d156-f659-459f-a737-94bf74ef6048,Nature Training,"From interview TV finish stay computer. Picture each challenge throughout.
Agreement job strong water. Guy project race partner. Test throw yeah mean public.",128e4907-4b1d-4636-a82b-8270b16cec8a,2024-01-21,2024-10-17
90bdd822-7485-431d-be77-240dccaaaf1b,Store Training,"East short often style political. Window stay Congress ability.
Care morning room debate few. Likely way possible available.",83df8c34-cc84-40b8-899e-8ffba14a439e,2024-02-26,2024-12-04
678f20e5-005d-41df-aa38-19eb87534223,Million Training,"After amount policy deal industry marriage. Lose site sure girl bag.
Relate as address beyond enjoy cause surface security. Wrong similar audience mouth offer.",cf3d37f1-5fa0-47dc-8a6a-50f7e4a32db6,2024-01-17,2024-10-19
5c47ebea-b1b6-4517-a435-fe26d0f7327e,Fund Training,"Hot single second up yourself here. Thank option fish point.
General old need memory interview hold attention game. Night nearly whether oil. Explain minute single beautiful power standard season.",ed4cf541-ff3e-45dc-9011-02fe4aebe5c1,2024-07-20,2024-11-20
903ffd87-9b6c-4c58-bb74-1688bb3e4fd7,Stand Training,"Community artist have suffer defense bank catch. Happen wall personal machine.
Imagine test cultural always plant fight work. Strong prepare knowledge.",d80c0ba6-f24b-4a47-87bb-b3036695a563,2024-04-17,2024-11-05
b3737834-b2ce-4c1e-aaf9-1ded194bd53f,Street Training,"Bed trip why. Energy subject political.
Push simply road ask property stop treatment perhaps. Money be heavy eye truth particular.",87d16d2c-146e-4c76-86d5-1a04ca7657be,2024-07-07,2024-12-02
49a85724-d430-42a0-afae-b58ff3df806f,Any Training,Animal employee how teach once foot ask. Store let mouth PM anything operation.,bd1127ac-5217-4516-a6c4-03fbb5f37bd5,2024-02-07,2024-10-23
043579fc-4178-480e-8833-c51676507e6e,Short Training,"It yet not way. Much instead area woman.
Forget money yard action carry meeting. Again security picture model.
Green low job everyone. Sound none right bill together.",44e01516-fc2c-4bc4-87e3-25db97b156f0,2024-02-17,2024-11-05
b88050b0-2712-4fa2-aeb2-246a30b4b95d,Artist Training,"Phone fight they everybody. Dinner ok kitchen some baby. Prepare could system head democratic job.
Account degree minute huge. Lead office politics fast which. Fly safe already brother.",e17e2557-f6cf-4ff7-bb2c-2ce4de6319f0,2024-08-13,2024-11-12
62bd050d-29c7-4670-8dc2-b9d72d20c33d,Thank Training,Later dog without team. Determine describe pressure lawyer charge rock. Recent member several allow. Court available her cause window.,bd4b028c-d207-46a9-b3f0-8c560ff67ec0,2024-06-08,2024-10-23
b19fc41e-b69e-4c66-9d35-f93d5bb848b5,Lead Training,"What happen person exactly. Civil describe enter evening.
Rise reduce art from.
Understand here exist direction report. Statement image share together account with assume. Order affect public.",d5765d75-712f-4125-a06a-1a99ee525e76,2024-09-18,2024-11-03
60b2ec5d-316b-410b-a27a-32576af5d44d,Plant Training,"One population worry its dog. Minute treatment evidence pretty hold staff.
Happen toward spring. And issue senior future performance.",34a57bd6-71da-40a4-80ac-0107b6deeac8,2024-02-16,2024-12-11
b0c347da-efb5-454d-9f50-d8e75e109027,Glass Training,Federal start hand mean site drug. Season debate send especially soon board son. Personal old huge behavior now do.,846862ee-47a6-48cf-81d1-7936ab49203c,2024-09-19,2024-11-12
8e1715bf-0695-46d8-bd92-7c076f6c3286,Modern Training,"Theory forget surface use soon.
History interest morning chance fund car cut. Worry expect thought ability. Top enjoy evening care important couple. Without low year including wonder.",622ba62f-4064-4f4a-8e3c-4fd849b22568,2024-08-28,2024-12-03
c3ca78aa-3ea9-45a6-badd-177e36a098ed,Let Training,Player hospital event old exist hair senior. Name current current other event. Crime now provide far gun.,1bb902ad-9fbe-4a47-a842-a4786897dd7b,2024-01-15,2024-12-02
c1ef23fc-0953-4a64-89ae-46f5f0102833,Weight Training,"History actually entire indeed. May spend provide whether particularly.
Vote service among. Surface town lose bed product within.",caddadd4-8389-490f-a489-2821cedb5098,2024-04-10,2024-10-21
e2a77584-4bda-459f-9f6e-c3c807fe83ac,Serious Training,"Others arrive meet born create what. Husband their detail.
Treatment later over learn building way. Open party particularly ask necessary.",f2500b8b-2f66-4d45-a259-24509ed2c4b2,2024-05-30,2024-11-20
4c37f455-fb95-4e4b-bbc3-93d604f12a0f,Tonight Training,"Serious down benefit tend certain subject. Audience standard investment summer close.
Impact black despite outside. House pretty spend growth worker box.",85ef4dc6-2ff5-47a2-8af9-f5d03d80f881,2024-04-04,2024-12-08
10f25e45-c55c-48b6-b935-0fb7e4c04644,Modern Training,"Avoid shake pass summer animal game. Idea tend apply guess thousand.
Food someone student huge try enough could. Nation weight entire resource long.",8bf0fc1e-7aa3-4f25-944f-9d7da3105658,2024-09-06,2024-12-10
61d48107-c07d-4aa5-b816-48726f84ada6,Still Training,"She impact man. Officer stay identify late morning. Coach woman similar ten hand. Member show doctor.
Similar goal send. Ahead why new wide together go force book.",89672fc7-9bf7-43c3-a42a-aabb3377d697,2024-05-25,2024-12-08
a52b5dd4-b415-46c8-81d6-431091e89d3c,Price Training,"Beyond dream government player. Still travel TV share friend century.
Head president general will idea it.",1124dd31-5020-4c96-99ff-dc93c311956a,2024-07-28,2024-11-26
3282022a-6bf4-481b-9372-20a63aa94d37,Lead Training,"State fund character hard act report. Plan say produce while audience. List rich soldier dream.
Anything environment explain produce point program economic serve.",96d0a33d-67af-4185-8789-e483b91b0a15,2024-07-18,2024-10-21
c0d253f3-288a-40d0-8925-dacb261583e0,Bad Training,"Understand focus sure task yard perhaps. Off fly through notice.
People event pretty military stock test whose. Kind affect Mrs even.",e3254340-f42d-434f-94d8-0eeca4d8759a,2024-08-02,2024-11-27
d3ed2181-48ad-4d92-b3a5-e05dd938d3b2,Community Training,"Court amount discussion drive. Campaign activity civil matter rather notice need.
Happy quality a sing food. Phone note their wear. Up that year loss top identify foreign enter.",e398c447-e02a-4709-8e5a-550b98cf5eec,2024-03-07,2024-10-17
5f1e56a2-1785-4501-955f-18d5c2c11fbb,Party Training,"Talk that bank step parent statement.
Spend long interesting house pass every wear. Doctor plan executive understand state.
Modern value consumer who two. Reality last into strategy.",7ca27418-68d5-4c61-8485-9ddcc03e8a9e,2024-07-14,2024-11-26
6d99672a-e71e-44cb-8fc3-d9eb6c4f15ab,Involve Training,"Several be place nearly mouth might. Between three maintain administration ask both.
Listen month prove onto performance step. Local reach meeting trip before employee certainly clearly.",4f8819c2-1434-49a9-9eb6-736f91e6676d,2024-08-30,2024-10-23
b4dca2cc-af1f-4ed0-a93e-2025efd2cabd,Our Training,Right religious movie least wall. Daughter science doctor mean. Set economy court price win knowledge pretty.,f62d9411-8857-41de-ab29-8ac6ca73ae41,2024-03-06,2024-11-15
4375643c-305f-4c25-8e45-d23718aaa347,Blue Training,Public into civil throughout benefit. Experience oil see best capital discussion.,5be9a030-68e6-4fd1-be7d-995da62788a6,2024-08-02,2024-11-24
0e6bf135-2f9f-4065-b679-e2b775948315,Talk Training,"First low dinner data. Cost leave side development.
What but include visit quickly look baby. Yeah social month effort land.
Break long whole artist heavy. Mrs choose least other vote term.",e579e964-20ea-4828-94bb-fc36edf1ef83,2024-01-28,2024-11-29
