course_id,course_name,description,trainer_name,start_date,end_date
883b5267-742e-4b06-82a6-d7bc67fd4d9f,Anyone Training,"Mother TV available of guess.
Success personal find let away tonight. Candidate argue page size car. Visit audience order song wife call several.",03653475-83e5-418f-9f12-07aa6129c72d,2024-06-18,2024-10-30
6af21077-d1e4-4daa-92fc-32fced25ba33,Radio Training,"According black television onto law. Program Democrat stop everybody. Light over station value account animal about check.
Seat total rich scientist here effort. Those size think computer.",ddf8fe01-92bb-4d8c-ac2c-af79a4aa08fe,2024-01-05,2024-12-01
ec8cccbc-f53c-4760-a189-88c3e8254cd4,At Training,Instead decade open project age. Agency along war difference type skill. Sometimes he career group some see property.,fa72101d-d8a5-4c34-a154-f21749c7eadb,2024-07-29,2024-11-02
0fc634cc-4c03-47a8-b513-e6c7336cf617,Particular Training,"City leg soldier add find option. Try million blood my if herself. Decide success against particular exist letter end.
Hold back street.",e398c447-e02a-4709-8e5a-550b98cf5eec,2024-05-17,2024-11-16
1183718e-50b9-4a00-876f-a1572480bfad,Unit Training,"Player fish indicate each try executive end. Strategy analysis threat wear. Current my light.
Chance community whose bit commercial mother. Job want speech audience improve special nearly.",29f90037-f0bf-463e-8d37-f6c22a528862,2024-02-18,2024-12-07
003e9810-ef5c-4f5a-9248-88a58550543f,Simple Training,"Without assume these. Strong dream than almost consumer size. Language person view court.
Difficult special military current leg. Cultural maintain hair account white hotel.",0115a278-d300-42ae-9bd9-6d82d06e40b2,2024-04-04,2024-12-09
e3bc5b76-338d-4809-b4e6-1c852c793ba8,Manager Training,Plant material game writer speech arrive president parent. Prove contain play trouble. Before according animal newspaper for see.,cc7e3eff-c811-4aa7-9b70-f0d86ebd8ef2,2024-08-20,2024-10-27
29dcbf17-06aa-4e3b-b0ee-e270866507f2,Speech Training,Increase like capital great card attention attention. Consumer inside gun side.,9ff41d60-0c0a-47a5-84f5-761b7269986b,2024-06-26,2024-11-21
b75ced8d-f6a6-472a-96da-a628de39c068,Able Training,"Then improve charge education summer class tree. Nature despite me deal that hospital.
Many voice buy letter through stuff shoulder. Heart approach front nothing require.",c13f14aa-08a7-4068-8a98-e9789ac1e85e,2024-04-26,2024-10-29
0c528868-eca1-4d0f-9150-5b9f375dd92d,Herself Training,"Quality certain citizen well enter discuss increase explain. Detail any glass.
Wrong away mind want. Recently home indicate defense. Four consider listen size herself worry letter.",181ef411-f51b-4dda-8ea8-0eba464e4093,2024-05-23,2024-11-07
11f6543b-48c1-4165-8549-620bf5d78614,Clearly Training,Structure mean traditional. Debate everyone sort institution individual everyone generation.,6abed786-cf01-4ed5-ab5e-452f92f37238,2024-06-27,2024-11-25
2532e0e1-67d8-4133-867c-055eb802b649,My Training,"Whether time huge experience half. Hand per themselves.
I exactly according international threat place. Generation leader develop nothing clear. Put social bed necessary tend recently.",e23a1445-e71c-40d7-b89a-1e10069bee09,2024-09-22,2024-11-14
7e2b64a7-bd6a-4d07-9d49-b53b69570dad,Meeting Training,"Serious may thousand too hold hit. Rise last always. Explain ready nor similar.
Less hospital these eat late bar else house. Cut fill process somebody join prove study.",c0298159-fd6f-4888-b8ca-ad5222f2d862,2024-02-17,2024-12-02
7825f14d-f87c-4684-9ce2-dfb4f639b677,Discuss Training,"Maybe religious doctor black. Management value history hair.
Interview feeling environmental animal pretty though draw. Last risk even past name. Place seek be now each hotel.",e170f97a-0dee-46fb-a6bc-3f3a9fb35477,2024-04-08,2024-11-18
075ee8fb-db08-41a5-8b27-4c4853e746bf,Choice Training,"Always us phone whose worker feeling. Page finally real fill. Hand foot after.
Arm among couple ago item light know of. Fight nor peace stock.",cc2d4c72-d01c-4b01-a8a0-89d943bebb95,2024-07-01,2024-10-30
039592cf-944c-40d5-b8aa-6533ff8e01b6,Lot Training,"Citizen perform see. Hold relationship sea build bit above especially. Identify push hope phone rather.
Like nearly until position seem upon explain yeah. Five life other Mrs.",07676f44-7ed9-41a6-9ed1-4be9bf207f1f,2024-01-30,2024-11-19
32f9506c-3f98-477e-ae96-a303a8dbdb16,Movie Training,"Development common can space what interview five. Most specific five couple room no soldier.
Manager else worry rather which. Manager yeah morning size skill practice.",2ed4f323-1de8-412d-8a3e-4546c0add4f9,2024-05-18,2024-11-19
9e4004aa-30da-4d98-a3fb-8107c1a035fa,Understand Training,Their method development relate dog compare. Account movement young occur eight over offer sing.,efcfe010-b721-4bc8-9b38-08d320e1bf78,2024-06-24,2024-11-16
f81b24f9-c145-48cb-9251-2fbdfab22e8a,Citizen Training,"Help dinner develop dark edge nothing.
Game fact company own. List face describe he war.
Animal hundred somebody paper seek exactly start. Vote position model. Law work film star religious red along.",3627243b-6e7c-456f-bcf1-ee6cd35a91ed,2024-07-29,2024-12-06
75f4ba6f-ad19-417d-aaf3-577a67191c9c,Able Training,"Official off clearly others general report this. Speak lead care ask also leave. Reflect political large notice.
Debate price various the next citizen. Direction into young cup night.",b693e4d3-92ba-4244-bffe-6108e0a0d661,2024-09-07,2024-11-10
eba160e5-07f4-48f8-9260-f540b6fd83ef,Sell Training,"Avoid training throughout wait identify throw example guess.
Station pass guy hospital style look for draw. Since stand wrong side foot food movement spring. Tough image go positive.",1fcdd429-5e2d-4e3d-9747-4640c34baec8,2024-01-05,2024-12-03
31b98516-5b4f-4e19-a716-4a6c3402fc75,Should Training,"Shoulder someone yes growth subject bar. Eat agent believe institution quality foot news up. Truth civil specific speak officer.
Present cell keep edge.",28931c98-e315-4d1e-8a55-1347db8fe004,2024-01-10,2024-12-07
764133db-1ed0-4277-ae7d-f06e5562c1a8,Us Training,Lot decide organization cold early fall. Read product claim woman western. Boy east yet possible Democrat store system.,84cab59e-bd41-4e7d-80a5-d98c8b36d7d5,2024-09-26,2024-11-02
b47c0b37-19ac-46ce-9229-01fe466d1866,Response Training,"Out trial name free. Bad board nation opportunity article strong despite decade.
Far source field herself decision their field. Raise seem in magazine space capital.",de8b643b-c901-4f66-9be5-69a984ef7cce,2024-05-19,2024-10-20
f7bfc1b1-776f-4fe3-8959-d62642d921be,Wear Training,"Positive trip central store suddenly long. New discover tonight science mission along official.
Discuss threat agree work top. Note hard oil carry participant avoid then. Serious form specific none.",108f2117-6f03-40ec-bc73-067205c0a53f,2024-06-22,2024-12-08
1878256b-fd22-4405-9f21-e53087a00eca,Skill Training,"Blue already character hair decade. Us child arrive hot treatment thus. Pass agency hour describe.
Ability focus visit TV someone.
Interest candidate such require even world all.",a8d14354-d90a-406a-a326-62e0487f68d7,2024-03-04,2024-11-15
17717814-bc19-449c-8158-2880eee1aabf,Reveal Training,"Old generation player property. Build one base heart least stock.
Notice end require task. Me student account say color offer go. Dog west west training continue require.",af9071b1-ca22-47c3-8345-32ca04c79316,2024-04-09,2024-11-20
5ac51dba-0f91-40e1-ae93-0843d3c1d20c,Give Training,Bank energy plant remain. Go drive over. Character can record central country alone.,be9ee421-4fcc-4b90-a27a-0a5d5d94b227,2024-01-16,2024-11-21
66b50fa5-3b80-422c-8e3c-908a3b96531d,Security Training,Road adult allow often. Know job building health. Bed indeed bill event color one success.,5bd63372-3e60-4d18-b4f1-e2182fd67dd5,2024-05-19,2024-10-25
08cbfd2e-5ad8-4628-b0fa-c095cb11796c,Kitchen Training,Important vote we sure talk successful. Relationship either data memory medical scene. Somebody lay evidence use.,e02b6a0a-f8c8-4062-90b2-feda8b48145b,2024-03-01,2024-12-04
92a69ab3-7ea8-4e79-9a8b-d93874284858,High Training,"One pay trial firm him almost. Body reality sing.
Player father plan contain while drop. You TV wait goal north.
Letter down usually program. Who be allow they. Tv Mrs over unit under various phone.",af0808fe-1c6c-454d-93d3-87a8ac4b9d4a,2024-08-20,2024-10-16
3451b06c-3fd5-4dcd-a733-787b61bc706b,Life Training,"Account floor activity easy specific. Than take walk but general available hard.
Effect learn image economy weight. Piece activity use feel level whose. Drive professor level college.",88b6cc98-2077-4d92-abd3-b380a04d82f7,2024-04-19,2024-12-11
a52c3586-5965-4025-ab99-acf305b7eb56,Let Training,"Article research mission some senior explain. Marriage focus who station daughter effect away.
I letter plan conference team employee into. Page best audience partner.",9741fc31-df7d-4800-b20a-c6fb292b95a0,2024-07-04,2024-11-08
cd277236-d049-467f-8e88-7f594cd88afd,Create Training,"Area senior space race lead traditional attorney inside. Son air model car more. Name claim study quite sure compare large.
Even car democratic term. Marriage water send push.",ce5aaf51-7a40-4b20-9446-2b7cfbb15cca,2024-04-16,2024-12-03
87e965cc-db87-41de-971c-a2f4715c0ab1,Science Training,Who west next newspaper state skin similar. Mission talk address improve. Top night Mrs.,de23bf69-5c07-4208-a735-519ea43929cf,2024-06-18,2024-12-03
ce83c9a2-ec27-494f-bf7e-2ca4d79322b5,Others Training,Pass season service determine imagine far forward.,0b2bce28-1023-4c3c-bb83-8d44dce90886,2024-07-19,2024-11-26
1d84f41d-8840-4881-9801-4466724a452b,Likely Training,"Last reduce big investment. Candidate responsibility add tree.
History speech yes nor. Letter stage loss surface treat authority.",3f4a9406-6877-41bc-bf5b-6751acee4f45,2024-06-30,2024-10-21
6ce56bce-2643-43ac-98ce-7cded9ac162d,Discover Training,"Republican author interesting national score.
Child young such accept.",f76305a4-26e8-4f72-9de9-bb21cec62939,2024-06-06,2024-12-02
752118c4-5457-4599-bb2d-675c4112384a,Social Training,Room knowledge item meet away above. Daughter them take yet fire model public.,0aeff7ab-c824-4de7-85a3-c4f9d006c01c,2024-03-13,2024-11-02
11b8f029-24ad-48a5-9da6-968344eb2983,Truth Training,Manager order area everybody one. Career too phone allow manage.,066b25f2-b7ce-432c-8b63-128ac44771f9,2024-08-19,2024-11-12
8b90dc7a-66b0-4559-b4c9-dcd41b683794,New Training,"Second explain though game usually. Sort what citizen.
Road whatever when born safe. Most inside himself clearly well. Computer nature walk already present.",41662326-23d7-443c-ae6d-8cb536a9a385,2024-07-02,2024-10-21
db60ee22-75a6-49ac-9488-d3260b762810,Medical Training,"Part thousand recently beautiful. War large fight center get air.
Green phone eat report. Cup billion over move store oil well attention.
Meeting out our I test.",a1b1eadd-99a8-4343-bdbb-6ca9feeddf2a,2024-01-18,2024-10-21
2410f185-3848-4d7a-a75e-796230acbe27,Country Training,"Staff guy relate black address very. Identify language grow.
Security modern manager cup whatever discuss. Community manager whose three or. Real economy type give bad.",d1b2e8c5-67b9-4ed2-bf1c-5212ad3fab5d,2024-04-02,2024-12-12
5925bcd4-7f24-4eac-b1d5-24e22c835f94,Administration Training,"Whether risk culture voice get deal third. Figure success like thus including.
Case grow collection ground right recent last. Billion big do call water.",87d16d2c-146e-4c76-86d5-1a04ca7657be,2024-07-10,2024-11-08
ea7c9003-93bf-4703-a7cf-5e9d16afd7e7,Hot Training,"Civil mouth fire. Partner production field toward fund. Book treat couple risk not rather.
Enter of door lot. Everything camera season particular can.",97e6c433-9356-40fc-a92d-efef6124ea30,2024-09-20,2024-11-28
e9d24dca-f047-44d5-a2bc-81eb57f3d9c0,Anyone Training,"Newspaper expert drop structure Republican military wrong. Surface parent raise hope bring raise way.
House give laugh on our bar eye reduce. Eight soldier either son.",54326dd7-40e1-4278-8a23-4112155332da,2024-01-07,2024-11-14
2b9aa27b-0836-4e2d-a241-5e2a58681834,Claim Training,Government statement administration evening doctor whose security. Edge series television challenge share ability financial. Matter top visit hospital.,e3254340-f42d-434f-94d8-0eeca4d8759a,2024-09-28,2024-10-31
d2c54423-6a23-43d5-bec1-23b71c32dcab,Resource Training,Note against listen response worker difference. Themselves charge accept son name.,0ca9796b-80cc-4668-a127-e3675beec404,2024-08-19,2024-11-07
652becf9-fcc6-4dd5-bdd5-1dabcaf72f96,Green Training,"Leave good church major boy. Little write know executive well white. Citizen rather situation soldier subject.
White hand low put. Way admit star contain unit. Environment money food.",1567e468-2dc9-461e-b4c0-46d6888808eb,2024-09-05,2024-11-19
35f20a5b-d54a-4769-a07d-ca6c3eda26cf,Particular Training,"Especially community increase hundred. Why light economic thing most identify senior yet.
Position camera management manager skin difference. Mention light work.",6b696a31-89dc-4f0e-b39e-ecbe032be2a9,2024-01-27,2024-10-14
88274c72-4870-47a0-a8a1-921a3aeb6696,Not Training,Store center what end entire theory industry participant. Matter far usually.,8f99f41e-0020-4e0f-ac62-467bf5de2caa,2024-01-13,2024-11-16
30f8ad77-b92c-4efc-a870-3938ec4d41a8,Fly Training,"Hour oil million better smile college accept oil. Base bad Republican it step.
Lawyer friend reflect population certain. Series particularly follow policy effect. White computer stuff hour way your.",cd29800f-d9c4-430f-84c6-397e7d03074e,2024-01-16,2024-12-01
c69893cd-f959-4a32-bb5e-f94de3fd6cfa,Office Training,"Send deal rule simply. Good test lot wait bring. Situation big drop.
Blood life scientist force statement account enter. Why south their. Many provide young minute. As successful against the he.",f28386e1-5e8b-4b3e-8abc-28f31285c0b1,2024-03-22,2024-10-23
81c7b28a-5b96-4914-8c95-5a4ffc5803e6,Really Training,"Remember final appear within war man surface.
Anything him table stop. Open place sure note economy will to.
Soldier box can PM fund those. Son small perform daughter finally.",2d37b05f-a875-42c8-9581-b3a645542cc1,2024-02-17,2024-11-08
7b252878-e5f1-4c80-9f8f-e9c10ac10586,Trip Training,Today few rich situation heavy. Quickly institution official me baby also.,d21ae911-fbd0-4d0b-aa5e-55ef5dbfd2a2,2024-09-16,2024-10-17
ed56d9fb-4b50-46d0-bea9-7e23a3d40875,Report Training,Fill nature day direction increase size partner issue. From resource provide medical.,fc52c468-0acb-4802-9365-553157d5009a,2024-03-29,2024-11-08
dcd276cf-aba8-41a0-b851-3f9ac4b8e5d5,Bag Training,"Interest listen teacher career. Government cell of those win ten. End thing million organization.
Behavior difference agent hospital share. Federal interest relate during.",7032f8b3-0d00-44b9-82ee-8ff7436772e8,2024-05-30,2024-11-15
35965638-c034-4d73-a60a-fe95ebfb3c5e,Discuss Training,"In center six foreign else. When enter ten mean other on.
Discussion drop spring nation strategy discussion memory. Long hotel require base effort.",6516fa95-9764-43e0-a514-fd12f4d95c66,2024-10-13,2024-10-14
2f108b93-52b5-448c-894e-f82e92915ba1,Letter Training,"Pressure every bank which article. Join physical free catch. Court meet she run sit.
Eye discuss win sort one pattern evening. Decide teacher for store.",6a3bbd6d-b4c8-49c9-8840-73b33cef029a,2024-05-09,2024-10-24
a80c1325-68d4-483e-b0a2-5d1a8847b9d8,Possible Training,President research learn understand moment letter. Would result specific cause American support. Discuss without newspaper police rise role physical clearly.,69f48619-af17-41c0-9389-999af7819e3a,2024-04-13,2024-11-22
9dbe4bd5-e75e-4f99-8066-a5016bb9ddaf,Information Training,"Probably son goal bad about ask establish. Generation such total exist board if future. Up most total kind.
Film get tree century. Thus claim share thus score above. Nice expert entire.",4ce3cea8-9694-49e6-98c9-e1b8b071ccc9,2024-02-01,2024-11-03
b062443b-3b95-4a86-8b56-98f3f0e0bd66,Note Training,Speech main share manager without home. Science child individual front wonder probably quite bed. Per establish practice.,56007168-9959-41aa-81e2-87e3a867dc26,2024-10-03,2024-11-23
cc695f22-9f24-4477-b8dd-f24e53ad3868,Decision Training,Board fund media. Research management movement myself. Choose hair think specific here technology moment thing.,5c9645ab-043e-4f5d-a09f-e30c048064db,2024-08-24,2024-12-02
59d03ff2-2ee4-4dd3-a2d0-c1715c2d2c22,Record Training,"Lay admit good main inside. Ok for government seem camera capital mean. Over similar industry impact far management represent.
Well room one available. Him police hope.",9deabecb-a004-4742-a7bc-1ccfd58a19db,2024-03-14,2024-11-19
9e936510-7fbd-47e7-8b6a-7e390da44821,Other Training,"Glass today seem live. Drug economic expect wrong. Start generation make room yes then she.
Possible will four wide only defense. Window through international population.",b54d0ffe-3aac-47e7-85a3-1e9fd5e7cb3d,2024-05-21,2024-11-29
f9f159b7-214d-4a93-b279-88bcc0450b00,First Training,Human return commercial general increase food myself name. Site resource across could remember. Live picture hold commercial with none.,12886b81-452b-4644-9e8d-f4f32ac1eeec,2024-10-08,2024-11-17
6c7d1968-65a7-4696-b8e0-47ce59ebbfc9,Cultural Training,"Treat day exactly find learn season. Specific expert court.
Stop have under picture. Media old billion. Else turn specific doctor determine pull.",104349f8-5a53-43fc-90b2-ea1882ce945c,2024-02-22,2024-12-12
25537669-cebf-4b9a-bfa0-5bc92fd08cd7,Nation Training,"Dinner my common anyone deep scientist per travel. Water price others state. Marriage perhaps several image heart.
Response program think upon. Your so put program.",84cab59e-bd41-4e7d-80a5-d98c8b36d7d5,2024-04-10,2024-11-21
a3a7f327-3e0b-43e4-ae6b-41d4b3f38082,Seat Training,Story watch turn attack fly surface none. Movement player brother positive some attack top. Next just lawyer race improve.,352eb38c-9a6e-4908-ac58-7c780f6165c7,2024-02-08,2024-12-02
59d695f5-ea49-4629-9514-741dbd77fd67,Travel Training,"Attack sound plan set society why add. Least read season oil note.
Model according pass great down. I one system medical story democratic. Total peace card firm perhaps president.",b55297a3-2b25-4ac9-b77c-4c287b6924d7,2024-04-23,2024-11-01
adf47382-e335-480d-81fa-7d85e06e3e9d,Finish Training,"Spring beyond very suddenly attorney attack.
Together event security dinner address. Political let respond fish.",e23a1445-e71c-40d7-b89a-1e10069bee09,2024-10-10,2024-11-16
927694ad-aaf3-4004-998d-5bf524477e93,Name Training,"Enter soldier leg region radio inside. Decade even usually manage happy choice common forward.
Off find total condition on speak goal. Center need sit audience address. Lawyer possible kitchen music.",5aa9a0c4-e5f0-4cb4-96cb-e3d44372a2e1,2024-01-07,2024-10-29
7eb07ad5-83e1-460f-af0f-6182e3d59456,Technology Training,"Whose figure play drive something land final.
Possible art our significant conference. Manager then customer question industry. Interesting seat who trouble.",903ab36a-0bd1-4a02-8b55-da9b8ba4c584,2024-08-12,2024-10-17
b6b40189-5ef7-48ec-a9ab-061e86ac057d,Quickly Training,North trouble whether station others leave. Structure party unit network behavior less. Bring everyone difference community.,9ff41d60-0c0a-47a5-84f5-761b7269986b,2024-01-25,2024-10-21
cc989d00-6fe0-483b-aa95-2583dceba9c1,To Training,This move call play attorney. Provide after quickly choose that down. Station other lot improve hour account such. Performance detail understand create.,a67f85e7-fb96-49e5-9407-41a9cb16e268,2024-07-24,2024-11-12
6ad31c83-7ff7-40cc-9d49-6d7d169f4daf,Family Training,"Type than similar everyone star stage floor. Continue bad actually report this bag. Manage word other read help.
Feeling market issue pick production. Teach director it through.",8f611755-fa0c-4296-9a13-cbf3aab31d7c,2024-08-27,2024-10-28
622ad30b-5723-431d-8d68-373f7cdc352d,Language Training,Sometimes business agreement who street. Medical check thank run sport audience student. Good involve stay friend modern. Nor hotel see.,7c1a75aa-492a-457b-b818-2e5962feee74,2024-05-17,2024-11-13
bc7ea63b-303f-4b56-bd5c-5e111061fd79,Increase Training,Ready until really race bed join fear. Month law pull. Sister take much bring father stand.,0e05d2ac-f70d-4b30-919e-6016daa47db2,2024-09-07,2024-10-21
8fd644f1-ea49-46b1-be8f-ad7a7a0bd181,Thank Training,Value strong maybe son. Man everything church throughout foot participant marriage management.,6e692ea1-6757-41b8-8eee-9270b7091a9f,2024-10-11,2024-10-31
4f749ae7-60b9-4289-b902-551894a4ed13,Growth Training,System score accept so behavior. Money positive hand fine father letter even. Lay marriage economy close college smile.,c1f059ba-69b8-4d55-abea-85ca4d52a5a7,2024-09-16,2024-11-28
6f9f85ca-3886-4c7d-b740-6dc47d594389,Arrive Training,Ago rock a piece probably. Live concern finally stop black particularly everything. West break history out let employee manage.,9995786c-48a6-44f7-9943-8fac9a465d32,2024-06-03,2024-11-10
1f26dbfc-fe85-4918-a73b-d087c52ff7e1,Force Training,System become standard. Operation base summer.,8d8ca924-8b34-4c24-9303-2ad6dad1aeec,2024-04-18,2024-11-24
231273c4-b76f-4c37-939a-72cbb2d959f5,Will Training,"Card bar month phone position enter sell. Machine wear what article.
Control mission through at help. Main baby look turn list we arm. Up film some place know.",852ee4f9-9476-4ac0-91f0-f5c108b8f5fe,2024-03-06,2024-10-22
e81ca374-d7bc-416e-822b-a8f4be08546f,Crime Training,After unit newspaper wear decade between put. Visit business guess term. Child voice occur series sit design.,56672f45-7b5a-4327-a725-15d20900fdf5,2024-07-26,2024-10-31
c7f0e598-5734-4ff7-a7f4-784e42441f06,Especially Training,"Seat arrive system who mind whole. Listen character material challenge forget home. Put reach party.
Might draw these against. Guy let because beyond shoulder behavior.",ffa1a8c2-9615-471e-8eb4-d990bc9660cd,2024-03-10,2024-10-18
256eb030-4341-4328-8b97-eb3de742884a,Name Training,"Our food lose. Turn degree break allow.
Major again try vote family. Artist benefit defense later lawyer.
By various into of white.
Including hour voice feel character.",7b50a726-8fd7-44e1-b288-6e4a1f94757b,2024-09-05,2024-11-28
bde2a0bc-c96b-4555-8975-cc286defddc8,Free Training,Break economic really information travel raise along. Organization heart call support he house. Particular politics field group provide thus.,19bc5431-f22e-4fd3-8b1c-0ec10be58f98,2024-07-24,2024-11-23
1625f700-8822-4f5b-8742-a27256cdf3c9,Check Training,"Use Congress join medical break prevent behind. Coach why doctor argue group line standard.
Parent project economic season. Change about part before least old.",7cc68bed-9c29-4841-9570-038f8d496b0a,2024-09-08,2024-12-01
017f56e6-7736-4340-9772-7ff000ece3ca,View Training,Article rest true deal see accept. Design drug child economic. Sea say key language data pressure government.,2951be20-8dd2-4861-91c5-754a969466bf,2024-10-05,2024-12-12
ff2dd64e-5937-444c-a022-0ee47ccfb14f,Determine Training,"Road wish light. Day piece laugh woman answer. Both my sea low.
Story Congress foot crime sister send. Wait many effort technology trial source very grow.",6d3ab779-07bd-40d1-b6dc-7f2ec754a75f,2024-05-02,2024-11-09
2fef6993-e011-4d7e-bb62-97a63a193232,Nation Training,Goal land agent all. Rock road argue there first middle else stock. Concern car art compare wait worry group. Tv dream pressure century.,7366e71c-a28e-4be2-aa24-67949c754cf5,2024-08-13,2024-12-09
b1811a8f-6298-4993-9127-e2d6fc32adc0,Ground Training,"Responsibility knowledge authority tonight well participant.
All cost provide into. Its than explain environment determine show.
Wear somebody drug national along think. He bag north national.",28d25774-d5a3-46c0-b3a4-fa58c99d3c9d,2024-07-20,2024-11-24
c831be37-e803-4fe8-b120-7fd303790e67,Serve Training,Interest other trip. Light against none about rule from word partner. Actually drive focus produce.,ea007bfd-cf23-4361-b134-05e0f73c076f,2024-02-08,2024-12-11
5c4a363a-032b-4913-9bcd-396b41a085b0,Team Training,East avoid wind scientist news leg building. Better who own body push whom customer. Land pattern suddenly sure factor central.,1a058b99-a535-4eae-978b-fa692d784489,2024-09-21,2024-11-20
14cbaba0-8937-45c1-9dea-a6e7abc764ba,Goal Training,"Chance visit add country. Lose follow maybe cold door structure. Politics morning someone born.
Short success outside writer understand glass.",de55e2a7-d51c-48b7-be58-bb8bad63be4d,2024-06-23,2024-12-02
0420756d-604c-4fd9-bb95-136952453032,Apply Training,Use produce while environmental few court attorney across. Stock view budget great. Sound sing couple member himself agent choice.,3c545bac-2bac-4701-a615-871c8e06915c,2024-08-26,2024-11-15
8c78494e-b95c-4dc5-b89a-cf06b4ee3cb3,Fight Training,"Set rise himself rest gas third suffer.
Final condition himself else wait. Third here early degree rich father.",41481bde-b45f-47e8-83a1-25d6aadc6bc9,2024-08-20,2024-11-14
aeeef5d2-5598-4651-bfa5-21a2279e8419,Window Training,"Subject part moment claim economic quickly since. Owner according build nature. Space effect difficult spring plant task.
Onto clear sort. Citizen east woman response door value. Region detail data.",b0c7ddc8-6084-4eef-9383-3015ef3af121,2024-08-20,2024-11-30
54737c41-8008-47df-b8b8-5a462f6bd08a,Baby Training,"Likely authority some among trip deal effort. Statement hear already role kitchen avoid. Finally almost seven partner.
Example kid him term. Look worker audience.",fd883265-537a-4ef1-b93c-dd7abcedaa01,2024-09-15,2024-12-03
07c626fe-61c8-4f27-9934-f28bc997696c,Recognize Training,Save machine standard range American able. Anything stop around set area walk yeah.,57eed34e-9d14-4c75-b1ea-e67bee9df1f2,2024-09-20,2024-11-01
