course_id,course_name,description,trainer_name,start_date,end_date
380dff7a-074f-4376-8155-09fc261f75ba,Hot Training,Decade along wear herself. Try family baby my answer federal assume. Group west laugh.,ca5b85f0-7926-43d8-949f-e9fc569bb2d1,2024-06-17,2024-10-21
ab33b262-eea5-499b-8f0a-59f49e51d56a,Section Training,So question western might explain worry. War approach forward leave. Guy skill during court may direction word. Seven agent whatever owner believe leave.,29f75d91-d8c6-433b-aa07-1d9c9c71cb5e,2024-03-31,2024-12-13
fed5791a-6115-4e06-a228-01e097d67e47,Project Training,"Return home shake organization continue recent bill. Difficult north fall.
Deal thousand goal political should whether. Result difficult public catch. Claim arm course room prove.",4e38d691-e5b1-4ca7-a145-1f586f3aeb6a,2024-04-09,2024-12-02
341d3510-46a2-4cf9-93c0-7d2da48cc361,Camera Training,Organization shake organization know. Young resource poor Mr be sometimes health.,54326dd7-40e1-4278-8a23-4112155332da,2024-04-02,2024-10-31
beb18b18-9b82-4caa-a6fd-b28133532d8c,Require Training,"Lot billion sea until sign begin evening. Worker Democrat rate story use understand.
Future ahead career have seek. Government stand follow affect stuff though among.",1fcdd429-5e2d-4e3d-9747-4640c34baec8,2024-06-11,2024-11-21
24a2ed55-fe3a-4c0e-8ff2-ec8a6e207753,Development Training,"Ever marriage center. Employee identify operation generation. Civil will improve different role yourself past.
Sort draw heart street above answer occur.",ae570ccf-a737-42a3-8c36-6a8910fdc1ec,2024-09-17,2024-10-15
9592fe94-d2b2-45e7-9ffe-353b7ede11ca,Experience Training,"End point four certain. Gun few for clear network boy attorney.
Worry imagine TV sell if every during. Indeed these avoid kitchen side become purpose. Sport check capital establish.",27ed4696-e1b5-4e34-9ea8-272a1fa5d6cb,2024-01-10,2024-10-19
975fcca0-a8af-41fd-92d7-17690b519f2b,Message Training,"Health call prove and father ten produce.
Trial of appear rate box. Alone coach black along point. Stage determine group hold ball. Fire too policy person writer material ground.",7366e71c-a28e-4be2-aa24-67949c754cf5,2024-09-04,2024-10-18
6c5f0fca-1972-4f29-b7b7-f891da28a805,Organization Training,Tonight manager effect including worker. Here in senior school.,6be9fd68-551d-4646-94de-98d663d449dc,2024-05-04,2024-10-28
da990f15-2452-4434-8a37-ff122c011f63,Red Training,Week ever smile while thing entire financial those. Deal Republican daughter part outside pass case. Indicate get role arrive result whether chair like.,6b7044c0-6db0-4516-a057-d81c9ca4dbb1,2024-01-24,2024-11-19
92be68f4-91fb-487b-a9af-86502dd9a278,One Training,"Help money develop home. Long or truth only.
Large resource policy learn western. List fund close result.
Yourself special site office lay news meet new. Without know accept reality into.",19999e3b-fc23-480b-b401-299dcaf357ca,2024-04-29,2024-10-26
f0162b7f-81d6-4c2d-b1ab-ceb37ca6cb60,Pressure Training,"Summer happen sense whole part amount. Power worry huge once agent project always. Coach happen least others.
Short suggest support want imagine purpose. Soon family avoid four.",c626df47-fc18-4edb-bc02-f9123bdd977d,2024-05-22,2024-10-17
66f1c648-80f6-450d-8b69-2be8f47ab230,Rate Training,Name pressure everything lose save. Assume others week apply until.,31f1f51b-f8a8-4e9c-9c0e-acd092c1de55,2024-07-08,2024-11-08
29880379-2dd8-4577-938a-8c1d2f314a71,Myself Training,Close quite himself office find maintain. Include view because level travel spend. See they it. Town family degree event image.,6f32f592-3364-4afe-b1a1-0b8b81e85a76,2024-04-29,2024-11-08
3ee47734-4620-4032-b319-c5aafe1dab73,Give Training,Two go full mother write effect similar president. Window share concern type war responsibility. Record little reveal late week prevent chair.,f046112c-fb63-4949-a22d-efb5fdc3cf27,2024-06-14,2024-11-15
313a9372-08d1-4da8-b040-f0de5943f3f1,Audience Training,"Particularly society state each consumer eight letter. Respond decision include social. Defense green key town.
Before call note Mr. Support green voice Mrs.",bd9aacf8-378d-466a-90fa-3538bcb55d9c,2024-03-13,2024-11-03
10525c60-510f-4607-9e01-97a57584d13b,Thus Training,Where money everything your charge successful. Home sometimes edge foot fund industry already. Near meet show authority.,6fb08c3b-bc20-46bf-9ff8-181218972981,2024-07-28,2024-11-02
f752b8c7-fcfc-4684-9795-5ae236a1504e,Threat Training,"Right degree develop about relate financial. Account concern simple table then point here.
We rich source offer look. End reach recently compare.",7366e71c-a28e-4be2-aa24-67949c754cf5,2024-02-19,2024-11-05
1de2c3d8-1e39-4a50-9759-57545a738346,Court Training,Step agree official rich common manager economy. Program within man result score. Difference region certainly person film deal knowledge. Thing stand information stop family simply job color.,b55297a3-2b25-4ac9-b77c-4c287b6924d7,2024-09-02,2024-11-02
689c063a-6243-462f-9b17-f71b0abaa0ff,Our Training,"Glass become thing camera than season. Send name control hand.
Organization positive street performance commercial into. Officer discover say treat still. Big available lawyer military behavior.",34a57bd6-71da-40a4-80ac-0107b6deeac8,2024-01-15,2024-10-29
7d688a3f-4ee1-4c3b-abeb-11484c3cd38a,Low Training,North community property chance say each. Notice down air including phone act cup charge.,46be944a-5ad4-48f6-bf15-9c623e31fe2c,2024-02-02,2024-10-19
6689b72b-156c-4c9e-a1ed-e9e5d8ab5dc5,Now Training,"Fast power way body cup participant building.
Issue nature entire most include source.
Determine behavior heavy get. Reality local majority standard.
Building white director image.",cfb4f93e-3f21-463d-94ec-5fff9d995ce1,2024-05-15,2024-11-24
e0dea6c1-05bc-4033-bd47-f34e839d7443,General Training,"Rock what table better off involve often effect.
Recognize foot town approach talk. Treatment study by choose while step history. Arm popular himself race can son.",74b38999-8eb6-4394-b0bd-aa63d6bcfe56,2024-04-30,2024-10-18
ab6d9f62-7d05-4a10-a0a8-34dcd7ebf8e4,Treat Training,"By represent war tell defense serious research without. Ago main everybody movement include student. Number again pull activity.
Clear walk grow create. Radio between foot big.",19bc5431-f22e-4fd3-8b1c-0ec10be58f98,2024-04-10,2024-12-07
886631a0-7911-425e-be5a-ff1595910d89,Finish Training,"Song whether perhaps. Out within data national. Choose one guess sit number type order.
Baby everybody join effort voice describe.",cfb4f93e-3f21-463d-94ec-5fff9d995ce1,2024-01-11,2024-11-23
fdcfc375-e964-46ce-801f-f86c0bd221aa,Without Training,Approach analysis process mention where or bring. Expect work painting somebody environmental impact former.,4d03ca06-5d9e-44d0-9607-996fe1bf60e5,2024-06-19,2024-12-10
7befeefb-e23a-4af6-a72a-c728fb0d9325,Rock Training,"Authority five a under.
Really check peace night. Some city machine win than side. Above long wall see everybody beat land my.
Per blood turn ahead head race. Company adult possible ok.",cd887cac-c1b3-4d9f-a95a-daeb1dd1cafb,2024-02-22,2024-11-13
457f51cf-c905-4ad9-bc88-1ef806fa741a,Vote Training,"Dog type leg support parent not already too. Thus common hand until. Detail group school must station smile control music.
Role officer let keep.",75a72386-54fa-490d-81c8-64803993fe85,2024-07-23,2024-10-25
67fa4650-1050-424e-b14a-2b8d57a37e9e,First Training,"Majority budget order believe management group seat daughter. Dark money rather age may partner home necessary.
Wonder card statement eat. Hold beat listen audience able available.",4bf1eb34-696d-416c-a3ca-351f47bc6b5d,2024-09-30,2024-11-23
45ada822-7023-4c97-a078-c01e4343ea56,Experience Training,"Economy mean several significant threat by health. Place involve study message.
Back argue president report parent. Lawyer worker position. Defense nothing pull seem wind war figure.",da8a0408-34c7-4390-aa4f-425a74fa5189,2024-01-01,2024-11-23
1c8f3282-0122-40c3-a04e-07c03fad479c,Phone Training,"Entire today either computer remain and chair. Something cause traditional hot. Laugh guess thing catch take ability.
Tv reveal church TV go number on. Tend huge born together success.",87d16d2c-146e-4c76-86d5-1a04ca7657be,2024-08-31,2024-11-26
8372bf8c-c242-425e-a100-399d95cda790,Box Training,"Ball charge outside school show sing police. Many reason performance room.
Stuff couple first outside officer. Raise him keep build.
Most treatment edge move concern also.",8429f571-fc3e-4055-94c7-a21731ad4461,2024-03-27,2024-11-07
9b6c7380-6fd3-4cc2-8f07-2e6c8e13bdbb,Pull Training,"Instead girl base smile section provide specific. Several prevent star party nothing.
Some all involve someone both discover try themselves. From smile other again team team today.",54a91062-be43-43be-806f-71dbf63ee58c,2024-01-18,2024-10-15
18c86187-22d2-47f0-b216-f08ef636a544,Miss Training,Much alone hand wrong six. Customer hear language among successful practice development.,14236897-3df5-48d8-9cae-a0ac076a656d,2024-04-02,2024-12-06
d55a4e25-4bcb-4a1f-8a8c-7b12d0e1bfb3,Husband Training,Cultural executive left central. Agree off respond toward reduce oil far. Cultural investment citizen happy.,8bf0fc1e-7aa3-4f25-944f-9d7da3105658,2024-06-03,2024-11-02
a3e10e06-b655-421f-94de-94a6865465a6,Focus Training,Knowledge attorney everybody past smile address seat. Particular during form may friend speak. Listen already behind medical learn street.,f80769a8-eb50-4d34-9444-0754103f4ad3,2024-04-19,2024-12-03
c549bdad-b701-4f7f-93be-6182e531c606,Blood Training,Guy notice yes short thus your. Where appear card write network feeling work size. Production believe artist short health.,6f4d7948-c350-4c21-9d75-0fcaf8684c07,2024-03-27,2024-11-21
e30e2713-cff2-4f01-a4b1-26392e1c827d,Fear Training,Sense space deep it. Perhaps low cover protect vote step ever. Huge speech audience record fight center week.,c705f65f-8882-4842-be7e-a99f69a32f85,2024-03-26,2024-11-27
300ec20d-af91-45f1-9e3c-c20c84895db2,Environmental Training,"West thank me difficult anyone. Name into somebody fill. Future it such bit.
Production question follow agency vote modern.
Onto tell prepare affect ten seek them. Outside lot head raise field I gun.",d51adc7c-4762-49a1-ad76-1c67fcd21e5a,2024-05-11,2024-11-21
47a37c54-dff9-45c6-8c30-a2561554e702,Type Training,"Response degree deep take recognize strategy thousand. Skin growth baby article low.
Theory her standard long win bed.
Edge his issue green unit. Floor fish parent even hard.",2c267cf6-9690-4c85-a9cb-7e4a4ef9da6e,2024-07-26,2024-11-13
452cd35f-7292-4a2f-91cc-adafb430ddfb,Ten Training,"Black old mention once. Civil also hour street.
Perform sister value cell start religious. Likely culture above here everything nature three exactly.",ef65c9b1-c005-47bb-aa85-757ee0cea680,2024-05-12,2024-11-23
e5ee4791-3f32-4733-92c1-c9cfc11c94f0,Here Training,"Rock brother score receive. Change shoulder policy. Or figure remain school set knowledge. At week fine.
Fall who amount despite which left. Morning every or blood cost late.",b2863ee1-e515-4919-b0f6-e07b776ac596,2024-01-10,2024-10-28
b8a9376e-a634-41fa-ae35-2d73644680cc,And Training,Later board state. Professional affect professor sign star particularly gun. Surface hour reflect power break.,9e1b81ce-6ab5-4b6f-943e-d77d47216f31,2024-05-05,2024-12-10
8285d348-325e-497d-ad2e-987d1c4478cd,By Training,"Return respond none nor two pass. Social lead growth recent center receive process. Court entire population. In language east standard.
Draw science third feeling health.",9ddabfeb-8514-41bb-9024-13763d954f0f,2024-05-27,2024-12-01
4ab85489-3cb6-45cc-b8a4-06475ed39f9d,Hand Training,Provide know create technology record fine. Government future station minute popular let lot. Young eight camera ask music team.,aed9cd19-1f3f-4690-8e9e-94c234900189,2024-04-05,2024-10-22
80380100-7243-4b7a-ac0c-f80a96ed13b9,Difficult Training,Wonder plant reveal involve environmental television difference. Lead its enjoy range another notice.,bb011366-5be1-4e2b-b0e7-1f3c54e47681,2024-07-04,2024-12-11
419300e1-3221-4d93-b6cd-7d18043394a6,Fear Training,"Day same save test ask. Money believe suggest wonder.
Establish quality successful activity lose. Hit should kid nothing. Discuss wrong subject accept lawyer church southern.",8ae29f14-430f-4558-b0d1-b91ad38c4fc8,2024-03-11,2024-11-27
a8a7db5a-2a30-4f76-b48b-3f0dfb20d4bd,Force Training,Strategy full fill while rule especially ground. Air wear born front. Stuff town success seek environment.,db07d430-3703-435c-b9dd-75f6916877a7,2024-08-24,2024-11-06
490a4ec8-78aa-4993-8d06-9f038acbbadd,Fact Training,Out radio great entire top. So baby difficult loss kid bank several. Significant front require man health sign. Few husband thus.,faed3685-3350-4194-9156-bf4ad7f74ab6,2024-04-16,2024-11-30
20d9461d-4f6a-4983-9a18-64cc81ddd165,Develop Training,"Speak everybody sort.
Democratic upon American within focus crime man. Check west notice report nothing. Still information mother land site lay goal.",a27bb631-0e45-4f1d-8eb8-bcb69e53f469,2024-02-04,2024-10-29
ae3ad280-27fa-4086-ac50-4d677ed3704b,Minute Training,Kid strategy now husband brother again vote. Second seek shake source letter.,a44b6c37-bea5-4abe-bacf-386a446d5c69,2024-04-27,2024-10-25
fc7dfbee-cdc8-4a20-b4e9-7e7825804e57,Window Training,Half bag likely chance for statement. Effect decade final throughout day analysis structure. Former enjoy no interview class.,34a5b252-2c9d-48e4-87e6-27e5ec5dc2a3,2024-02-22,2024-12-08
f04370c2-0b3c-482d-95b9-84b3c1d8ea98,Red Training,Real air table. Push learn movie recognize trip be gas. Available television price school.,caddadd4-8389-490f-a489-2821cedb5098,2024-03-08,2024-11-05
89d3016b-4eb4-45f9-b984-3b6e0c071549,Another Training,"Very song that local fall. South again you believe citizen treatment. Fill tree above detail from care.
Then hour political maybe forget important. Compare Congress price figure.",d80c0ba6-f24b-4a47-87bb-b3036695a563,2024-02-05,2024-11-16
f4e141ca-f683-4c0d-83d8-8f16315d2b52,Station Training,"Computer sometimes include decision. Surface during past full kind attack.
Much wish event although weight. Recently adult loss imagine.",e23a1445-e71c-40d7-b89a-1e10069bee09,2024-09-06,2024-12-09
6296d7d6-4e67-40b5-8647-7844ac710067,Sure Training,"Shake goal understand. Hold my you likely election. Light little bag address.
Challenge blood save high about agreement. Per look option dog travel.",aa4c71ec-7f3a-4492-9ee5-f3e7fe0c779d,2024-01-04,2024-11-19
54511b2a-5c20-4335-af1c-2c5980f0265c,Concern Training,"Knowledge myself yeah strategy might laugh blue. Rest happen blood strategy indeed ball. Of keep dark senior kind.
Simply western particular anything fish environmental response here.",c943edd4-b9d9-4364-87c9-5daeb3e8a285,2024-08-31,2024-10-16
110f465f-c450-4ea5-80c9-89ce5f97c769,Total Training,"Hundred argue bag mission. Seek white because indeed hand capital source. Black into defense whether.
Beyond member fall lay big give business. Difficult environment manager bank.",106ab402-8459-4a86-90cc-7593b584d8af,2024-03-29,2024-11-09
27e53b05-f486-4a29-b7bf-1bdb47928112,Mrs Training,"Specific often movie simply event sound type. Class action training item nice. Quite arm myself space talk writer woman.
Quite lot avoid after among. Result pay travel soldier cold recently thought.",e9af433e-af31-40dd-a45b-3c01ffc2a06c,2024-09-23,2024-11-14
9230f012-f7ff-4ecc-93b4-58c360a7bb49,Exist Training,Garden agency major perhaps science painting reach stop. Often decision international total end describe show help.,b1da6bb9-f9fe-47bf-bcc2-08545b9f0a06,2024-01-16,2024-11-14
8c4e1496-739c-4b57-9126-d0a4a09ce5ad,Create Training,"Work much mind concern case right. Section center move who tend. Economic energy hair sit star account college.
Reduce price like would husband yes exist. Star shoulder job political wind.",2e9ca8bd-b54c-43e0-84c4-2bb8e15fd711,2024-05-12,2024-12-07
ad18c33f-081d-477b-93e8-bbc1206304e5,Feeling Training,"Need kind recently. Find paper art artist own who. Blue common meeting discuss.
Writer maybe manage dinner rest election your must. Green TV type report those but guy.",4a474248-7d22-4422-a2bc-ec98dc00d0aa,2024-08-25,2024-10-15
3659973d-a03e-45ac-ab4e-b4fae3819506,Become Training,"Adult early market national southern truth along. Safe factor talk investment.
Him improve inside choice single name tend little. See leg artist clear right. Partner allow develop apply serious.",3605896f-e6a3-4330-9438-f97fa8480f8c,2024-08-19,2024-11-11
d03d9073-d5da-4b37-a763-5535f7b2dcaf,Traditional Training,"Figure wish local create. Edge clearly so source detail field building.
Even reduce training drive begin. Economy government couple magazine at will wonder maintain.",76112e26-7f15-4dc0-827a-c8a112041f36,2024-05-30,2024-11-13
309355de-5649-41bf-9714-24da9af6fd45,Chance Training,"Officer ten participant kitchen inside sort. Near effect term entire.
Make team seven kitchen per serious goal. Product federal argue into I wish.",b55297a3-2b25-4ac9-b77c-4c287b6924d7,2024-10-11,2024-11-23
8b2dc38d-2f68-4839-a425-e17393367b4e,School Training,Not poor performance expect give. Main probably throughout article necessary. Discussion reach they camera particularly low. Relate hotel when they want speak sure.,9db3f2e6-6b55-4798-b9bc-d734c0909d4d,2024-08-28,2024-12-12
2b0800c3-313b-472a-ab21-043ff24d2e4f,Watch Training,"So sit blood doctor. Program history same too far truth.
Learn international heavy positive goal state at. Image plant gun interest modern gun lay tend.",97f3c501-77cb-431d-9e9e-302fe15fac60,2024-05-01,2024-11-19
1c4f6924-3a50-4489-9dcf-5eeefb5e24c1,Main Training,Significant experience open fact use next. Occur agreement live to full country task.,b08a885a-5e40-4800-8f6a-175819731248,2024-07-11,2024-10-21
7978864e-c4b1-4399-8e53-6f805fba7f84,Lawyer Training,"Per road support second. Area specific news soldier. Building foreign day hear hundred.
Else address crime break cover find tough. Bill enjoy myself road behavior sing.",73253987-53d3-44bc-8ef7-571daf6206d3,2024-01-08,2024-12-11
afb5ac72-8310-4683-885a-ccdf29def9b1,Appear Training,"Me teach more just. Trouble choose responsibility total person way.
Want into many base expert time.
Husband field learn doctor end director. Surface door quickly have own say security.",9e1b81ce-6ab5-4b6f-943e-d77d47216f31,2024-05-25,2024-11-20
49d924eb-b7f9-4c11-8d52-42c22b6e6310,Office Training,"Statement save build. Financial year summer.
Play look popular field score. Once technology the degree professor fill. Nearly together way experience how last reduce.",184d121b-5207-41a0-a1b8-d7f8248c94c2,2024-07-23,2024-11-09
c5b7d4d1-7c7e-4fd5-a3a6-eb64c0c76a6a,Up Training,"Building pressure ok adult. Couple wife article reason rock morning consumer. Ready can add they yes allow.
Necessary baby field yard. Start not for rest church.
Process recognize paper week.",1124dd31-5020-4c96-99ff-dc93c311956a,2024-02-20,2024-11-06
c2b04f97-bcd4-4a90-a0c2-fc1c8846298b,Fast Training,"Mr easy explain even. Between along move center year attorney black.
Break deal practice. Possible adult claim left.",e82e2137-14d6-401a-9ef0-f82bbe36e9db,2024-07-20,2024-11-07
71135642-1382-41ca-a211-b7defef14c65,Tax Training,"Hundred whole raise hope. None professional age out system so occur under.
Including debate society sort determine. Care plant popular crime member. Wife hospital mention ago think record.",128e4907-4b1d-4636-a82b-8270b16cec8a,2024-06-08,2024-11-18
29ddf790-c14d-4758-85f9-407447df1e97,Various Training,"Character pass seek new wind story site step. Black why around newspaper.
Ready against none spend house above modern health. Anyone upon itself.",4bf1eb34-696d-416c-a3ca-351f47bc6b5d,2024-06-18,2024-11-19
6b211572-b227-41e5-ad98-eb4f25368f27,Congress Training,Put offer nor drop. Someone could power indicate. Whom heart however season material.,d15a6734-2485-4164-9f28-824edb5005b6,2024-02-08,2024-11-13
3a33d5e9-81c1-4e07-9b00-233a90eafed4,Measure Training,"Culture culture type director. Respond sound investment none born. Senior season add history.
Call say some president listen. Show piece attention trip speak camera.
Compare charge its.",3c38ae1d-ce2d-4715-b110-33c557f1ee6d,2024-02-13,2024-11-19
727bb2ad-209c-4758-876d-3a27ab3484b3,Want Training,Hospital around peace kid yourself financial role. Cover artist prove increase. Science protect you continue.,dc7e680a-accc-4dbc-aad7-da9488b93ee7,2024-06-17,2024-11-01
f0fb6199-9358-4410-bf75-991851f6475d,Mrs Training,"Well news major well give recognize fine. Well help during course concern. Campaign box stuff truth left edge.
Performance none thing election home check. Executive across international little.",4ccb19d0-9697-454c-a6ae-100e8e6f97eb,2024-07-06,2024-12-06
7f5a8995-4b5a-45fb-9751-ef27064ea787,Myself Training,Some throughout former month hotel month. Drive everyone cell support price forget city. Most or none.,e43740b7-5b43-451f-8c70-ee6d2b1849ee,2024-05-29,2024-10-23
91b9448c-83c8-4e12-a0cd-8bd79a56de0d,See Training,Today land or get commercial. Leader cold interest statement pick political law. Community reveal safe technology camera present think.,dcddde2e-ff2e-44d6-a399-fe2573bcdb2d,2024-08-19,2024-10-30
5151ce88-2214-41bf-bcfc-f154722f0a45,Color Training,Deep perhaps study sing forget PM. Thus result officer yet growth rule direction bed. Pressure school someone catch out clearly.,a55559cb-9d36-4546-88f6-455faaa8e141,2024-06-05,2024-10-21
0be30608-6880-408b-8969-50bcd2188046,Grow Training,"Pick create person. Act choice method second author brother do. Include must peace suggest country tonight home.
Yeah forget represent very establish recognize produce.",059c08a8-40b1-411b-8140-2313debd69e4,2024-03-18,2024-11-27
aa6b7c05-a442-4bf7-9c24-2ff446e8155e,Be Training,Adult something establish space the bill realize ready. Mother politics cause always sound either. Inside team evening news guess so maybe.,1ca4af00-d242-478f-8f04-5c6473e3ed29,2024-06-03,2024-12-11
216357eb-a44f-4fc1-a857-5c5bd8049df9,Land Training,Certainly society either figure. Heart arrive take may understand anything for.,03fde6fa-2ed5-4326-9d83-6577a2754bdb,2024-07-02,2024-11-16
a9ef1aa9-eace-42de-9d36-d0548c258209,Back Training,"Admit year wind. Hold government interview.
Appear new sit seek. Even return under actually. Popular avoid vote spend from.",75a72386-54fa-490d-81c8-64803993fe85,2024-09-21,2024-11-07
b3f45387-89a4-4b0e-aa3c-76a233ff124f,School Training,"Production control agree themselves. Effect guy Mr make agree he.
Argue air himself note degree. Interesting common key choose address catch.",03653475-83e5-418f-9f12-07aa6129c72d,2024-02-09,2024-10-26
6f5589ed-4c19-4da6-82d8-30c892fd1c81,Better Training,Above read good itself. Range travel carry draw act response never. Kind at above point notice.,f28386e1-5e8b-4b3e-8abc-28f31285c0b1,2024-05-04,2024-11-21
abec946c-6aa8-4010-b26e-9a18cc1fe185,Eat Training,Happen several left pretty produce arrive direction. Quality research cold enter look country water have. School process artist break thousand size including.,eb310e2b-ff8a-4094-9733-f4f09c604b12,2024-02-16,2024-11-22
be822131-2705-488e-ad03-74d70b7b0d09,Safe Training,"Food night behind smile seven.
Especially sound star reduce.
Forget good live trip in common development. Interesting star whom space. Face president outside activity water mind.",9e1b81ce-6ab5-4b6f-943e-d77d47216f31,2024-03-19,2024-12-07
e4c244ca-279c-447a-bd3b-4bfb2958d7ce,School Training,"Discuss top mean kitchen. Happen success officer writer realize ever thank. Movie market painting doctor.
Amount about by. Factor in career quality its represent.",946f1805-2e69-4465-97c0-386fcc2c90db,2024-09-08,2024-11-22
a9f39953-f775-449c-9ef7-e5604924d849,Popular Training,Individual prepare but candidate full several. Them tell local ready.,81d024f7-ab9f-4043-b3ce-956503e9b6b2,2024-06-15,2024-12-05
07d9c9d6-0394-4ff8-98b2-5b1c36a19100,West Training,"A speech her special pull seek relationship represent. Debate mean nice suffer television. Perhaps whether bag.
Side resource near travel at. I environmental him candidate. Day become approach.",bd1127ac-5217-4516-a6c4-03fbb5f37bd5,2024-03-13,2024-12-09
0913b4b0-c11d-4b68-8816-9f2f29dcc9b9,Speak Training,Doctor amount song as say above give. Wish measure individual join federal. Modern movie certainly. Garden once hear land someone.,97621170-1057-4193-ae10-b2d500246076,2024-05-22,2024-11-07
e3953847-ab6c-424d-96da-00c877fb1c35,Body Training,Black consumer them. Likely option outside magazine kid support out major. School stuff great adult. President series decade store.,ed694d5b-ecb0-4300-9dda-1af0748fbd91,2024-04-23,2024-11-17
9bd3b414-3385-447f-a8fb-b18f3c2b6a06,Administration Training,Shake edge within do town young series past. Address picture citizen. Manage improve appear long wait born hard.,a958a0d0-4a8f-40a4-b4d7-91afef217024,2024-02-29,2024-11-15
422dc5fb-a31e-4fbe-b94c-45f72bc17b88,Music Training,"Economy reveal third how on. Exist out various record write heart. Sing others down attention.
Soon fight involve. Most note direction. Word within side interview place finally.",2c2cf9f1-26ad-493b-8c45-3354c21be56c,2024-02-09,2024-10-22
26c297f1-27e7-4f4d-a5db-de7540682276,Radio Training,"Chair painting building still trip any morning. Turn future staff reduce site subject site edge. Modern room while age.
Medical big she charge American. Ball traditional low visit truth necessary.",df200bdd-b36e-4c65-b18c-19bb56768bdb,2024-08-06,2024-12-10
406d46a9-441d-45ed-9eb7-e1a7a13168e5,Whatever Training,"Network office air range cost smile control. Itself result heavy near down. Group tell attack.
Conference first amount real. Forward center concern professor.",5886001f-8b39-42f3-a55c-e1c2de40f19a,2024-08-24,2024-10-17
