course_id,course_name,description,trainer_name,start_date,end_date
23401c68-5836-46fa-a77f-b5e23355161c,Become Training,Over first present security together alone put town. Sure drop guess shake impact nor special fly. Receive unit spend health end. Admit every six yet war.,f95d86d7-2b2e-4340-8972-e1683828cf01,2024-07-28,2024-11-25
406789bc-02a4-421c-af5d-8ba3a3c86020,Who Training,"Song a operation them. Probably inside ground good look find citizen window.
Piece great lose high style. Player future try group college hit relationship. And lose plan also.",517f80f5-6928-4992-ab94-870c1159575a,2024-06-01,2024-11-06
aba2bafb-44f1-4062-9314-f9d8f7bd2a6c,Evidence Training,Imagine visit some option ability. Help avoid individual leg simply. Father will cost like. Make growth behind major.,b6c8907c-c383-4f0e-bf92-79cc787fb8cd,2024-06-02,2024-10-17
ecff59bc-0f51-442a-96cd-f6e0e3ad51f1,Us Training,Dream most financial conference indicate whether main. Pass skin reason nothing along without. Customer national likely can explain pay anything girl.,954c5cbd-1f5b-472b-94e3-96d12a727bba,2024-01-07,2024-12-11
37c597fe-f53f-41ac-a4a0-6dcfb95b46a5,Break Training,Whole sometimes high stage sport.,acea180c-54ea-4358-9305-33da04a3e776,2024-08-20,2024-11-20
4d82013d-30b4-4290-b47a-5f4989b760b5,Too Training,Often economic piece phone I pattern. Sound budget his important tonight dark. In but difference society economy argue they. Skin environmental music less.,013f5956-5d8a-4460-8f57-4fb83b8bd677,2024-04-12,2024-11-09
97c2fa73-31d1-4bab-a85b-41951fb56e2d,Degree Training,Past child relationship night kitchen message street small. Sit eat rich question lawyer age toward customer. Stuff between pretty option want edge region.,246c890c-a66b-4fe3-9f31-ab484932aec8,2024-07-15,2024-10-16
6a1265aa-332a-4ee6-84dd-64d29768c59d,Reduce Training,Practice certainly wide every happen someone we. Structure four piece. Share keep test animal day image economic question. Not and accept everything soldier.,3e3789be-f385-4575-8d8a-25f01fe92bc5,2024-06-11,2024-10-21
f946ec01-7018-4a8d-87b0-e670b484e277,Provide Training,Figure camera sometimes leave. Notice coach allow child can statement. Position beyond include decide former window design travel.,15e34a49-b020-403f-a342-35854799e628,2024-07-06,2024-11-11
12978e01-2fbb-4e70-ac24-824b8f18f41a,Including Training,"Look really worry suddenly among old leader. Seat house future sign.
Writer answer company institution science try. Leader any price citizen war.",2d0cbb87-fa3d-4f4b-89d6-fc8242481185,2024-05-15,2024-11-07
9bf87e4c-50f4-46c9-876e-4a1cc479475c,Drop Training,"Speak anything list party guess usually mind. Son stuff treat attention go let.
New natural last for have believe give. Week hand realize operation just movement.",c0bb312b-fdab-4091-b87e-60c4a9e9e8cf,2024-10-11,2024-12-07
f8a62beb-cbf5-4558-aa11-c32026bb5aaa,Arm Training,Available clearly film according seek. Organization people notice cold mean no low. Body leg develop detail.,4d850861-2527-4761-8a72-0af66893261f,2024-07-15,2024-11-01
5df35e65-4e1a-4656-a218-c77b6d7b0ff1,Feel Training,Political social whatever again avoid foot actually. Carry family religious seem front cause ahead. Him himself look include.,a552bd55-0c14-4a03-ad6e-530d3be64fee,2024-04-01,2024-11-16
65e841a6-db1b-4b9e-9c1d-6b28a4ed0c63,Indeed Training,"Generation crime debate moment century word line. Mention boy east hard. North sometimes thing seem back.
Discover American off rock. Garden short event fall world.",20a85c60-8b3b-4dd1-a59f-6d0a2471ddd1,2024-01-18,2024-10-14
02258ae3-9d36-491a-975c-7db0ff9eefea,To Training,"Stay base education near none born. Choose administration measure.
Whom worry message agency member. Actually see yet understand. Alone air father fall information until case add.",eb310e2b-ff8a-4094-9733-f4f09c604b12,2024-04-05,2024-11-24
cd268a29-3d58-443b-96ac-dd4e3975567f,Health Training,Pretty sea ever bank candidate range beyond. Involve professional thank drug available check.,f5923f76-cb66-41c7-a9f8-1e22653a5f5b,2024-07-13,2024-11-08
daf326bc-b0d2-40d9-b1c3-72e3be5eebf0,Each Training,"Behavior anyone go road change campaign.
Stop hotel movie water. Once they eat ability no.
Allow believe free whole. Home town onto beat them.",1d27f90b-4318-4275-ac44-11f36103dc1e,2024-01-13,2024-11-20
5307d806-42c9-4186-a569-b17a2af770de,Front Training,"Continue this operation respond.
Less such once question put week wife enough. Final every buy here. Scene official activity police do.",42d8d5d5-bbfc-471d-b5ff-7ec5ee028caa,2024-05-29,2024-11-22
1a9200b7-d5e7-46b0-b894-7179fab77c16,Magazine Training,West surface human pattern. Trouble represent improve.,bf55c4c5-a556-432c-bc3c-536f132dd741,2024-08-13,2024-11-02
4742afc5-57cd-42a3-a80c-f4b3619bc0d5,Quite Training,"Through development house really. Paper structure agent quickly.
Drive ball upon become weight national huge expect. Both method almost hit respond life.",7cc68bed-9c29-4841-9570-038f8d496b0a,2024-10-08,2024-11-17
28464d54-81e3-4a86-9cb9-171b42ce323b,Live Training,Especially result air cup citizen population still must. Hospital many range deep. Or bad hope.,089a7ef2-7756-4098-ac75-476ce5365169,2024-04-12,2024-12-11
82b0a035-29ad-4abb-a0f5-9f0d5ec0c3ec,Drop Training,Artist food model can important relationship beat. Follow enter move tell tax personal. Short here follow paper off above.,0be074a2-ea2f-4ca3-aaf4-4796f05db245,2024-06-22,2024-10-16
762ce3d3-3105-44e5-9c42-afa4e11caa02,Summer Training,Different successful give computer explain. Represent exactly when wide protect trip detail. Play until car during.,0d48debf-5d88-4d2b-90dc-8616304cd00a,2024-04-16,2024-12-03
0fcd8cc1-9a56-47ce-95e7-5c0f3e697b26,Seek Training,As but oil beautiful structure usually structure. Just establish fear system high them rock. World pressure season agent his open do.,6c62552e-b311-4423-97ff-5210b4a63777,2024-06-19,2024-10-27
abec6c48-8c81-42e0-925c-e57de4bb7b2a,Movement Training,"Strong unit fund president. Well size article family story show Mrs.
Hundred fine business high. Property prevent leader sign their.
Even name training stop along national foreign partner.",1cd3f930-c7d0-4e76-8ca0-3d7acb09eb00,2024-03-15,2024-11-30
84b4c932-2805-408e-917f-8f78025afdc3,Bring Training,"Foot head conference effect remain how before risk.
Throughout wonder power include teach meeting. Letter yes participant number sound. Film outside between rise.",b08a885a-5e40-4800-8f6a-175819731248,2024-06-08,2024-12-01
7105dcf4-4351-4efe-8ce7-8ace6720b234,Investment Training,"Choice my among design society set event. Article health black from alone other million.
List forget say why leader. Road tell break now church mean.",e71c939c-287c-4b4b-9677-c36536d86911,2024-04-18,2024-10-19
6ab2f69f-9e44-4fe5-bce7-6f9befc818c4,Far Training,Reality research others a church understand. Bank work book hospital director.,b5f20e39-5bad-4cbb-8b08-2061b699fb97,2024-09-06,2024-12-04
7423e061-a4d1-42ca-9985-f4a7047c6f7f,Decade Training,"Then let according eight situation. Person fight concern according.
Money return to thus tend trade. Leave notice radio international.",6f9c8cb0-9755-40e6-892a-5af2b362b1b0,2024-04-17,2024-10-31
b311bb5d-359b-433f-9686-21b8aeff8506,World Training,Else trial around among impact air. Meet relationship answer attorney blood foreign understand. Coach thank door all office long several. Determine deal social spring thought cost evidence big.,2ff95833-7c8f-4484-86b8-121c28fd14bd,2024-06-23,2024-10-27
0d123f70-d7db-4d18-8a40-b05e881c4bc9,Population Training,Serious they me ok before opportunity treat perhaps. Reality value despite identify line structure. Minute conference range let as whose have likely.,c6d43868-09a2-48c4-a260-8beb8d6b50f4,2024-02-14,2024-11-23
33e4c3ae-7003-448c-b478-f8b7e5012df3,Seek Training,"Decade light least everything foot. Ok director mouth prove or.
Say force respond structure mouth. Response while five sell cost benefit until. Feeling everybody soon save.",cc547e24-dac2-4e2c-bc5e-ae4854a4650d,2024-04-09,2024-10-26
5ac955a3-1501-48a8-a2bb-b48946034d80,Minute Training,"Market wrong seat town sound health. Local green character behavior senior lead.
Increase Mr manager theory enter recently. Outside almost series respond. Happy less all late no.",3add8c43-85a8-4714-989f-7da34b51d0db,2024-09-05,2024-11-06
3e61cf2f-be4d-430e-b185-fc72e4b4274c,Happen Training,"Thus four mention gun approach move across former. Back rule relate box.
Look myself religious sit reality statement. Miss price front.",28ce5548-86cf-416f-a824-6249df676691,2024-02-02,2024-11-22
7b36278d-02ff-49f8-85af-370ad9a0156e,Industry Training,Decade look financial including air behind cover. Skill still box or return fight. Environment us almost get all one its. Draw speech son important town.,cf1d36d4-3e53-4c72-96ec-27e304e008e4,2024-06-07,2024-11-28
cb0fd910-11a2-4ed7-a4d2-fc11791edd1d,Nice Training,Risk they season always citizen degree medical. Great only country condition. Material provide risk style human put.,3ed19c0a-dd6f-40e1-902f-1e34208e07b3,2024-06-24,2024-11-22
5d2da996-aa32-4a23-a344-2380e1bd3732,Also Training,Political lawyer exist drop home people laugh. Civil war life accept. Politics against condition serve.,bfc9cf9c-072c-4b41-8dc5-db9402f8c1bb,2024-08-16,2024-10-16
1b104000-7576-4c8d-8a1b-73fb97c07f74,Build Training,"Bar full oil price claim. Animal at check so money. Capital report foot part.
Carry exist learn store kitchen. Real course similar once writer early.",ef65c9b1-c005-47bb-aa85-757ee0cea680,2024-01-13,2024-11-03
0dd13cbc-6348-4978-ba15-a3a39b3a098a,Evening Training,"Point to nature side sign. At half husband sit senior must term. Likely year four turn.
Light five coach yourself bring. Lose thing send.",54ff1dec-ebcc-4fa1-9261-6f7ac00551c3,2024-08-04,2024-11-29
70b49ed3-6e52-4a5f-a6b9-44a2488db775,General Training,Then finally improve security president. Respond deal subject reason among must.,38782f42-70e5-4063-b408-8fe7a1f128a6,2024-07-23,2024-11-13
3cf69370-55dc-4685-8d38-d6073331676f,Individual Training,"Friend difference idea light practice. Over cup have where middle between.
Sister hear word health decision. Management stay former. Maintain result check particular turn security suffer sing.",1afefa2a-ea89-4ff6-9008-8b27ab1100a2,2024-09-29,2024-10-24
02cc4883-6ebb-4c56-9657-06d8ac661886,Mother Training,Suggest resource president light second third heart follow. Year assume defense continue bank per myself. Customer season buy often away different check whom.,d5765d75-712f-4125-a06a-1a99ee525e76,2024-10-11,2024-12-10
15bd33bf-d6c0-4b18-a6b9-0cdfdfafe707,My Training,Such wrong mission mother what house toward. Spend among they rule service time.,17292b54-0036-4599-b48c-cc967bb2e77b,2024-06-11,2024-10-25
b89fb918-3b32-467e-bb11-ad38fef6834c,Agent Training,"I sound above fine doctor experience when design. Detail son also.
Computer half hotel commercial. Gun sing thousand. Effort western difference doctor particular though pattern.",68062f70-d6f0-4f3a-8533-2d144cc8c13d,2024-02-10,2024-12-09
bdefaa37-d14b-4e3b-b31f-a0358e05e723,Movie Training,Within common program whom lead employee. Weight foot lead star phone instead present.,cfce1a2b-1115-42c5-9d86-3b9d4f5399dd,2024-03-11,2024-11-11
ca88b792-cfeb-41d5-b72b-325c0f1756b5,Ball Training,Drop trade eat money check smile gun. Treat network human. Shake site factor theory indeed.,a85dd59c-66cf-458d-b987-a5497e66cceb,2024-07-28,2024-11-27
1965e8e1-42dc-4513-90b8-7d0593ba1564,Total Training,"Technology perform sport she. Edge raise do theory it unit author.
View but job bit director race not. Far also choose build draw house challenge. Life need where off Democrat doctor assume.",f47996a4-cf0c-413e-a4ea-80a745d41bd6,2024-07-29,2024-11-25
44d7d00c-ae82-46b1-a6ab-7fe6167a1db2,Middle Training,Challenge be success small fill man. Make push response prevent. Class half himself Democrat. Industry maybe crime attorney.,c54be40d-5816-40e9-9329-7e9c54a705ac,2024-09-16,2024-11-14
1e1d1a85-37a1-49eb-8b74-362b4aad089b,Financial Training,Fill that simply study beautiful any above. General out rule avoid.,0aeff7ab-c824-4de7-85a3-c4f9d006c01c,2024-09-03,2024-11-08
322eba5c-cbe5-4ead-baec-8fe072ba861d,That Training,Feeling heart size key question attention. Measure change position tax industry. Make two relate my thousand.,15e34a49-b020-403f-a342-35854799e628,2024-02-23,2024-12-04
410ae83a-7415-4edf-8d1b-f57398d8ad43,Record Training,"Measure some no authority past operation democratic evidence. Leg adult expert big that. Owner cell grow.
Black life popular sit answer interest political. Total event threat study follow full pass.",aca788fe-66f0-431c-848a-e1cafe3828b2,2024-07-24,2024-12-02
f8cea16f-a30d-4c5b-9e43-6c25c570515c,Usually Training,"Idea him material top their.
Threat American determine media Republican edge. Seek true them. Particular method parent class.",d35c6d30-7c92-4e22-99f4-7dd3ed557f33,2024-01-14,2024-11-21
2f228120-1ab3-44be-814c-b85528fb9098,Hair Training,"Example participant brother responsibility only. Scene itself task for thus happy. Hear serious score.
Mean environment involve hand concern affect build. None new huge detail north.",a75f906e-905e-465f-b681-2de8ba7ba815,2024-09-03,2024-12-13
40944a7c-a2ee-4692-b675-4d87ff9b6e0d,Administration Training,"Work she short night actually enough. Recently state later over soon create pressure occur.
Happy city seven. Stay behind life now their toward.",80c3531b-047b-4b9a-98d0-3960beb47668,2024-08-21,2024-12-05
93ff2506-cd9a-418c-927c-29f6acf08559,Art Training,"Learn forget student fish piece conference. Special could deal table control.
And culture choice try peace. Democratic one individual physical. Nothing mean no door.",cfce1a2b-1115-42c5-9d86-3b9d4f5399dd,2024-09-15,2024-11-06
e642ce52-d4c9-4a97-8d02-3a2110f4cfda,Pretty Training,Difficult including around maybe ever six place. General let while group until social probably.,28eb0d0e-66c4-45c5-b069-871db14f4c0d,2024-06-11,2024-11-11
c1b276c8-50e1-4585-b4b0-50058f831e90,Third Training,"Itself of design fire right however drive.
Town effect factor many before. Still most history grow evening.",598436d7-1266-48f5-9108-d3a4187a3602,2024-03-26,2024-11-28
58b6a3f3-0748-4e43-a1e7-7782b5e00eb9,Number Training,"International herself wife major kind.
Opportunity tonight hour. Our child score about it suggest or imagine. Help bank give response small I.",9995786c-48a6-44f7-9943-8fac9a465d32,2024-05-21,2024-10-27
a832382a-6e7b-4e23-963e-d490148901d4,Doctor Training,"Road series explain plan another father. Common require control window.
Wonder resource particular everything where someone measure. Theory fish culture.",d624977d-5953-48d4-aeb8-597f3bb15e66,2024-04-08,2024-10-21
c4461837-5d0c-45e1-a859-168a62c89e3d,Exactly Training,"Bit return sister listen TV nation catch. Set everyone must and language decision compare democratic.
Quality national painting agree. Agree visit marriage leave organization including sea middle.",bc464498-4d0e-4190-ac19-9bda75616c10,2024-02-29,2024-12-04
5c57cebd-a14a-401a-9114-5e1a3094a9f6,Product Training,"Discover meet almost not budget building story a. System expect in window civil month.
Before list over television.",1f225e6e-e005-4856-80d6-56b91a15c5ff,2024-07-31,2024-11-02
58d37022-bc79-4a71-acf0-1231702a5d59,Practice Training,Development prove thing in newspaper. Rather per any capital sing board. Great officer speak policy. Late medical bank again ask environmental.,80f3f938-07fd-4bef-b769-d0943bb8bbf8,2024-09-20,2024-12-07
8bcd0c46-b74d-406d-85ac-160dbeda2c95,Single Training,"Authority training whatever either we. Top everything bag. Bar that hard safe age.
Free worker religious indicate growth. Table different away lose however society. Senior many process identify.",6c354c84-b76a-4364-9b7a-daad263d7212,2024-09-12,2024-10-22
d54de138-c5ca-4dda-8231-7f53790ee99f,Trouble Training,Responsibility middle pass remember even exactly will. Her east establish.,c391d15e-ff13-47cd-a466-932cf5da91fe,2024-06-01,2024-10-21
ac93f0d6-a878-4edd-838b-3969028d3ca1,Husband Training,"Base none property artist political teach. Lead name allow occur day read action ask.
Defense yet not machine. Allow traditional boy. True risk boy.",e82e2137-14d6-401a-9ef0-f82bbe36e9db,2024-06-06,2024-11-16
bf2fcdd4-b179-4da5-810a-9273d362445f,Resource Training,"Outside trade firm performance poor size down total. Few black even series culture control.
Force force along information sit technology. Either note only adult bag past.",2da9c9fb-6cb7-4fe0-87c9-83f40e1a8155,2024-01-12,2024-11-27
39a57dbd-ab55-45f1-9520-695acaf745bc,So Training,"Piece movement memory character morning Democrat.
Know sure owner century. Away large include fast pick. Return religious know seat also.",7d5bbf43-33e8-4189-acc4-50d88916e396,2024-02-20,2024-11-30
603587e4-82df-4d53-b899-efa30c08f32b,Meeting Training,Water food bank color. Agent local sign ball from age another. Goal stand exactly wall man near product.,0f5127c8-ae84-418e-a2fc-5542bf252882,2024-09-12,2024-11-24
bfd5ede6-15ef-49ca-9dde-0b900ed62bf8,Throughout Training,Goal condition shake. Son ask relate agreement mention home between.,db07d430-3703-435c-b9dd-75f6916877a7,2024-02-20,2024-11-07
e5b3b185-f142-402c-9c84-2e83b2d00bc8,Reflect Training,"Cold down huge room free phone. Various suggest worry cold reflect answer five.
Clear action instead level. Gas water enough interest song.",f7f07993-039e-4681-8004-054287d760b8,2024-07-12,2024-10-24
7ae363a3-d72e-4269-9f7b-8a3c71eb9dcd,Almost Training,"Again red doctor make past. Strategy someone education detail accept student student.
Cultural scientist say condition save dog out. Summer above behavior Democrat.",565b54b3-930c-483b-be0a-f672559a7f42,2024-05-22,2024-10-28
053ddd44-b392-41b4-9b48-d3a25c2af89a,Season Training,Film first your face. Fear medical whole out hit position thank. Partner though collection seat material clear.,a75a6170-2183-4ec4-aa1d-6bbd83046201,2024-04-11,2024-10-19
e9259b57-8988-4345-8b23-b9509c24dcf1,Turn Training,"Mouth his front hope adult peace. Thus baby air court. Week south speak mother each improve question.
Magazine direction history site both forward wonder. Of hospital situation interest it third.",2f8f8b6d-c24d-4c58-a036-b1c4ac685bd0,2024-07-01,2024-11-17
6d8e2958-7c61-44b0-a8f8-c0256ba307ef,Meet Training,These wonder reduce order prevent scene. Resource ball pass. Party evening enter who major.,d21ae911-fbd0-4d0b-aa5e-55ef5dbfd2a2,2024-05-31,2024-10-28
13412889-15f8-4db6-b110-2492019790cb,Color Training,"Again fish approach old year. Run candidate force suddenly kind.
Send this meet yeah something. Great hear line find important run.",73253987-53d3-44bc-8ef7-571daf6206d3,2024-01-20,2024-12-07
661d9f66-2023-4844-8fbd-801bba1d435f,Close Training,"Control lay property others picture report. Year early any small store.
Price seven accept practice. Later suffer improve chance very them how wife. Hair wife lose interesting.",6ac4c461-beb5-4f58-8c46-de555d53217c,2024-06-04,2024-11-02
ed2be01a-d76b-4bb3-9368-102a1c28a0ce,Trip Training,"Stuff force fall would fund rise state. Less source card. Whether write yes would fall.
Prepare rest know happen green human respond. Over test yard learn. Resource store study maintain open.",1afefa2a-ea89-4ff6-9008-8b27ab1100a2,2024-01-18,2024-12-01
b6dca591-1763-4254-bfc8-4d553bde1a6e,Trade Training,Grow civil main recognize Congress despite since. Animal minute help.,fcdf84fe-d1e0-41f1-8f85-4d268490bd09,2024-08-14,2024-12-03
3f2ece58-922c-471e-8a7e-1aeb58068010,New Training,"Away improve data morning here look whom. Region whether eye important ten.
Third firm experience put add. Low church environment brother available soon knowledge return.",9046cff7-d2a5-4d9c-8982-31da254efe9c,2024-09-30,2024-11-04
16612821-0cef-48d5-bb02-80a036ee0bcc,Up Training,"Power car throughout. Evening easy movie hand.
Professional possible such prepare. Challenge hundred success scientist few.",6acb0e9c-70c0-47cf-9921-7119adac2ec8,2024-01-15,2024-11-23
bfec8bcb-9766-4b8c-97a1-873220883bfb,Baby Training,"Response peace candidate measure industry conference short follow. Commercial mention involve style necessary school. Card which group board use.
Why natural week fire analysis participant.",4dc5207e-9ceb-479f-81c0-affb4a129019,2024-10-08,2024-11-27
47fd38c0-d57f-45af-900d-f8f14ec94998,Consider Training,"Wind more part idea front issue pick. Year sister now car tonight.
Have skin deep approach. Pay nice half keep we hotel machine.",9c078243-359c-409f-a5f4-533f0a823584,2024-07-09,2024-10-26
41326599-2be5-4a46-b3f2-d41ebb2a4193,How Training,Rate write moment improve seven look view. Seat carry over physical able behind physical page. Break president than various your.,af0808fe-1c6c-454d-93d3-87a8ac4b9d4a,2024-09-14,2024-12-07
fc31ef50-965d-472a-b186-90e198609e3c,Kind Training,Data know quickly. Prove although yet rather attention. Kind here call a sell morning carry president.,1ff5008a-6744-4b93-8627-75f0f3befcd0,2024-01-18,2024-11-05
9c334291-f20e-4988-bd55-ab56fcd99a9b,Throughout Training,"Draw check water hear out should. Life I air key left put or.
Security personal enough mission no.
Never itself near religious red time.",480e208a-1210-4010-967e-a650dc32eeb8,2024-09-11,2024-11-09
ab98f08b-b35e-422d-ae62-228f6652325b,Break Training,Follow nearly product coach worker might. Stay finish gas according. Sing word part issue song management.,bde4d2e3-e89a-4f38-9915-87ab91df0cd7,2024-08-29,2024-12-10
d763b90b-beb8-49e8-9289-1d07299b64a5,Indeed Training,Seat watch appear interview star sometimes. Stand finally decision bring ok room. Performance cost under note third data anyone unit. Everyone easy project into American meet draw.,cbdfe0e1-673b-477c-8066-7fce25e2a8aa,2024-07-31,2024-12-05
bfc33a8f-ec05-41ff-9d6f-cc7565af041d,Peace Training,"Something black available money property. Whether choose loss light structure hair.
Feeling arrive information Democrat everyone fish defense. Hard throw indicate blue what around public.",874a0181-c4d6-46f4-a27e-ad30ffb745cf,2024-06-16,2024-10-23
a8345646-05cd-4a84-b8d0-9eb37c8686f4,Manager Training,Act week watch anything exactly fall century follow. Most huge on already step.,30163ead-8192-4ab6-9cd0-1aaa5c40c2d8,2024-08-28,2024-10-17
7136c748-0bc1-447e-8d00-6e236eaa493c,Economy Training,"Issue plan home head order soon. Try kitchen act building technology seat hour.
Treat animal theory bar. Agency bad data.
Expert technology draw give receive.",69d0c298-f98b-43b1-a4a6-7bb51dbcaf41,2024-07-19,2024-10-21
fe5d3c5b-5cb8-49c8-8384-c7461221f9e7,Argue Training,"Strategy walk home.
This myself sign we nature arm particular. Prove mention majority quickly couple maintain white. Interview growth weight.",fc9bce59-b8ae-4f47-a43b-047ce96fc59b,2024-03-21,2024-12-03
1220cb22-2890-4a66-af24-df241f546e4a,Push Training,"Into before which light. Before instead community position rest. Thus speech kid able simple grow former.
Gas police board sea. Upon box his out perhaps notice cup. Shoulder need throw yourself.",402f62f3-1f3f-4940-85ef-a8b8e53dda28,2024-05-18,2024-11-17
5293a8d4-748e-4584-8c29-23e818c1ab6c,Congress Training,Too couple some particular sea research. Professional left between ten.,6f42e8fe-8cb1-498f-895b-57421e1afaa6,2024-06-20,2024-11-09
6a93c957-df8d-40dc-9c0a-4215a069ef00,Society Training,Recently ball one include some. Force race person religious catch skin. Top figure whether project him ok.,a3e9b773-fd5b-4d71-93d8-8d4a4009bce9,2024-09-23,2024-11-03
7b212305-3fbf-4b41-8c08-3f476b1c4096,Main Training,Scene sound statement lawyer much skill. Base style traditional care fly message live. Attention six source truth age protect.,e5c6a6fb-5e9b-46fa-8b1a-c4839d91c856,2024-01-26,2024-11-09
bce4fc5f-49b6-4427-953b-6fb0c8f63959,Character Training,"Drop green if past time yes. Mouth fly these ability three public international.
Information my such. Woman similar require throw. Organization partner to series positive dog.",bec45b3a-59a7-4645-bf60-30b67dc711d8,2024-08-18,2024-11-12
3b5ac98f-e9c9-48b9-81f4-17fa4c7abe92,Camera Training,"Around article instead speech matter. Occur down decision hour drive.
Training knowledge their manage win eye.",40fed25c-8b2a-49ee-835d-df0d83304147,2024-04-16,2024-12-04
02c4ef7a-b24f-4f86-8a56-2e37b495bc35,Chance Training,Put these subject those animal real reality. What professor model use federal choice across create. Allow born paper read.,9f119514-954f-4faa-ba5c-797a116dfbbf,2024-07-06,2024-10-20
d581373b-0678-47bb-8f68-d9e8bb94582b,Care Training,"Conference subject section debate degree yeah.
Care indicate authority take soldier.",868319b2-391a-4b94-8836-4cc63ae9627b,2024-01-17,2024-10-22
63561998-f1c6-41ce-8f83-e3485a13108b,City Training,"Condition lawyer power identify.
Green without record interesting section. Between human population plant major structure or. Fear myself those memory hot foot.",8871d60d-fcdc-4075-b27f-36537b34540a,2024-07-06,2024-12-10
099fac3c-4d09-4e26-9720-4a46b26851a8,Able Training,Nearly model traditional really as great. Feeling certainly case already particular yes above yourself.,7be82b41-1c70-44c5-98a8-698718be26ef,2024-10-06,2024-10-22
98268e6c-2eb5-46ef-b126-5130ef820efb,Similar Training,"Cover case job serve draw woman. Finally get personal talk arm if.
Physical part hard man a member. Seat than choice speak. Light performance today subject mean few prepare.",b01d9321-2375-468b-a660-00ef0b4654cc,2024-07-20,2024-11-20
9bf76b2f-9e8a-4815-b209-6a46455dd080,Laugh Training,Describe model position mouth behind. Realize I leg carry catch hope. Them before security computer view energy.,7d5bbf43-33e8-4189-acc4-50d88916e396,2024-07-03,2024-11-19
